article_id,newspaper_name,edition,date,page,headline,byline,article
13_1835-07-31_p2_sn87062070_0039334295A_1835073101_0939,The Arkansas advocate.,01,1835-07-31,p2,"THE GAMBLERS,",,"soorAr1oN, formed in this town on sunday last.

 Our course with regard to the Gamblers who haunt this town, has called down upon ,,s the anraadversions of both the Times and the Gazette. Our readers, therefore, will haze patience while We reply to both as brief ly as possible.

 When we first published the account of the cxcesses in yicksburg, we uttered senti- ments which we shall ever entertain. We then declared that we could not look without horror and disapprobation on such scenes enacted in the eyeo of the law. To that opin- ion we still holland the reasons for 1t are, to us, strong and conclusive.

 Every man who urges, as the Times and Gazette have done, that the people should take vengeance, in defiance ofiaw, whenever they may think 1t necessary, is urging the people to throw down all law, and to establish anarchy, revolutionary fury, and popular im- pulse, in place of 1t. It is confessing that q republican people cannot pass laaes by s0hich to defend themseEues--that our Government and laws are weak-and that sse are not CO., pa5le of seycgouernmem. They INSULT the people by telling them that they cannot make laws strong enough to defend themselves. It is lamentable condition of things, when VIC gre told by those who are the watchmen of the people, that tho only way for us to defend ourselves, is by trampling on all law, and re- enacting the scenes of revolutionary France. Our convictions on this subject are briefly told, We detest the Gamblers, as class of beings, as much as any man who has signed the proceedings of that Associaton--but it Is our firm belief that where the sanctity of the law Is at stake, tbe end does not ;ustyy the make new ones. We are the people-and con make them. While we belong to free and intelligent people, we will ever spurn from us and expose the man or men who shall dare to tell the people that they are not sem sible enough to make laws to defend them selves--that they should have either anarchy, mob law, Lynch's law, or DEsPoTIsM. As we are living man, NC would sooner choose to confide our destinies to Napoleon, than to the will ofa people only governed by their changefnl impulses. We shall speak of that part of our subject again before we. conclude.

 We were called upon by William Copp, professedly gambler, on ""Wednesday eve ming, last week, to publish the article which appeared in the last Advocate. He offered us our price for advertising, which was ssoiee the common price. He paid us for 1t, we published 1t, and marked 1t paid. This course has been the subject of censHre from both the Times and the Gazette. 4 few words to each of them will put them out of cur way, and leave us to deal with the public, to whom alone we arc answerable, and to whom we are always ready to account. AS the Times comes first, we will dispose of 1t first. The Editor of that paper accuses us of being i'll favor of the gamblers, and of being brought to favor them by the paltry sum of fifteen dollars. We are not in favor of them, and will explain, in the course of a few sen- tences, the reasons why we published that ad vertisement. At present we would only say, that fifteen dollars may be an unimportant sum to the rich old gentleman who edits the Gazette, or the very liberal, careless, and profuse publishers of the Times. No man ever suspected either of the three of loving money, or caring more about it than their neighbors. To us, however, being rather poor, and penurious withal, which neither of them is, fifteen dollars Is no inconsiderable matter.

 We are sorry that we have lost the friend- ship and good feeling of the Times. Ne as- sure that paper, however, that we cannot be forced into a quarrel with 1t. We are not it's political eaemies--so far as any body knows any thing about its politics-and we have mo- thing to induce us to injure it's Editor per sonally. He has been rather protase of hard words against us, but as he seldom seems to know what his words mean, CT to have any ideas scattered about among them, we do not suppose that he meant any thing very bad about Us.

 The Gazette also rcprobates us--on both pages of the paper--for publishing an adver tisement for which we were paid And now a word or two on this subject. When an ad-"
14_1835-08-21_p3_sn87062070_0039334295A_1835082101_0952,The Arkansas advocate.,01,1835-08-21,p3,II M.ArrERs AND THINGS IN GENERAL.,,"""A public meeting was held at Fayette- vile, on the 8th inst, to express the opinion of the people in relation to the propriety of making immediate application for the ad- mission of Arkansas into the Union on an equal footing with the original States. The meeting was unusually largs, and resola- tons were passed in fdpor of .State Go9elqs- ment, WITHOUT 4 SINGLE DIS-s SENTING VOICE. .''-.4rk Gas.

 Missouri The election for members. of the next Congress took place on the Sd inst. In nCape Girardeau county, (the only one from which we have seen returns,( the vote stood as follows A. G. Harrison 505, "". H. Ashley 4s2, G. F. Strother 4o2, J. II. Birch 2a9.--i6,

 Pensacola, as we had been. expecting to see, begins to agitate the question whether she also, lying as she does with her superb harbor between New Orleans and Mobile, rfiay not contend with those rival cities for the great and golden prize of the trade of the Mississippi valley.-The more the competition the better, and we think it will result in this; that d great rail road will cer- tainly be constructed across tRe cotton re- zion of the States of Tennessee, Missis- sippi,. Louisiana; Alabama and Georgia, 10 some point on the Atlantic, in the Gulf. Mexico or north of Cape Florida. It is d work that must be done.

 By letter in the Vermont Chronicle, from one of the American Missionaries in the Sandwich Islands, we learn that there are two nea1spapersp published there. The natives however, feel little or no interest in them.

 The oldest woman in the world is now exhibiting at the Masonic Hall, Philadel- phia. She is one hundred and sirty-one yeals 9 age.

 .Not Bad.-The following toasts are from Virginia:

 By Student. The People: Who are the PeopIel-The newly imported banditti, who flock to plunder like yultures 10 car cass?

 By Joseph B. Lindsley. Virginia She was found in the uon struggling for liberty --she will be found in the rear in the strug- gle for Van.

 The United States Bank have declared semiannual dividend ofthree and half per cent,

 The Lynchburg Virginian of the 2d ut. contains quite lengthy description of the destructive storm with which that section of thecountry was recently visited. The entire strip of.country which was within the track ofthe sform--supposed 10 be mile and half in width, and probably from fifty tossixty miles in length exhibits a most distressing scene. of desolation and ruin. In Lynchburg it IS supposed that not less than 20, 900 panes of glass were shattered, and the damage done IS estimated at more than S100,000.

 MT. Latrobe. who travelled with Wash ingfon Irving over the praries, has publish ed his tour. It is highly spoken of.

 A young lady of New York lately recov- cred $500 in an action of breach of prom ise. 1t was proved that the gentleman had gallanted her twice ffon camp-meeting tent to the altar, picked up her handkerchief three times, gave her a kiss Ia sugar one, and called her Mary, instead of Miss Mary Tubbs. Have care ye camp-meeting eallaDts."
5_1835-10-01_p1_sn84020071_0041418294A_1835100101_0161,Litchfield enquirer.,01,1835-10-01,p1,,,"The last ofthe Pirases.-Francisco Ruis, ,he Car. penier of the pirniica schr Pnna, whose comrades were executed three months ago, was executed on Saturday forenoon at 10 o'clock. It will be remem- bered, that this individual has been rssped twice on account Of his supposed insanity; bu, the physician during the past month had become perfectly convin- ced that his symptoms of insanity entirely fsgn- ed, and his execution wns accordingly determined on by the U. s. Marshals-Boston Gag.

 Not Sio,o.-""Turn out turn out or by golly I'll you as did l'oiher day."" hallooed Jon a,ban who with his gall in his lumber box, was abou, coming in contact with dandy and his fine gig The afrighted beau, sndly terrified at the mysterious 'hreat turned out, and Jonathan passing. ask ed him how it WAS he served the other man. ""Why. ItWrRsd out myself"" .s..t. ... ....-... t. 'You must""s smoke here, sir"" said the capain oi North River steamboat man wao was smoking among the ladies the quarter deck. ""l mustn',, hey! why not"" replied he, opening his capacious mouth. and allowing the smoke iaziy to escape.- Ddn't you tho sign all gentlemen are reques- ted not 10 smoke abaG the sngine.'"" ""Biess your soul, ,ha, don, mean me-I'm gen,eman-not bi, oft. You can't make gentleman oi me. no no you ] ca"" fix it."" So saying he sucked away, and took , the responsibility. Times. ... ..t hopsfui SOn.-Papa, snid little boy to his faith. CT the other day, when fellow strikes another

 bains he go, right strike back I Certainly he has, replied the fther the law of self.defence sanc ions it. We'll, then, I'll tell you whn, it is, said ,h. hoy, the next iine you box my ears I'll hit you blow | under ihe fifih rib. %

 ""I cannot pay for the Steak Mir. StaliEed,"" said purchaser 10 the butcher, ""bekase I've nn,hinR bu & one dollar and its unlawful to e6er it."" @

 don, mind ,haI,"" said the Butcher, its not unlawful to take iso hand i. ou. and here's the change. The Regency cannot possbly stop every hole i"" the law. | Noah.

 The National Gazette says. that {"" no good citizen will, under any circumstances Lynchs law We think otherwise. If good citizen is called li- ar or puppy bis face, he knock the offender downf And isn't ,ha, Lynch's Law 7-Louisvilie Jour 1 We learn from Washington and on undoub.ed au. ,horiiy that the leuer of Mr. Kendall Mr. Gouvern- eur had the unqualified appreciation of he Prssiden,

 -and that the General has been heard repeatedly to express himself in terms highly complimentary to the Post Master here for :he firm and patriotic views w,h which he met the case-now let the Post !"" lay o""."" 1 ~,t ~. r. Etc. Star.

 7Rs purchass of 7ssos-Ws mentioned a few weeks ago, that ihers . abroad that rea-

 y was tn train in Washington between the U. 8. and 1 Mexico, by which Texas ceded 10 the former.- | Oar information now is such leave us but lue | doubt of the fact To avoid all constitutional ques. tons as to the right purchase, the following plan we understand, has been adopted: as the line be. tween Mexico and the United States has never been run by the authority of the two governments, and of course is still unsettled avoid ali expease and con.

 roversy hereafter, for certain payment in money to be made o the Mexican government by the U s. n is agreed that ihs Rio dol Nors shall be the dividing line.-iVatchex Cosvier. -1a.4ra f3nsa.t. The Rev. Francis l.. Hawks, rector sf St. Thom. ass church NewYork, has been created by the gen. erai convention of the episcopal cburch, bishop of Louisiana, Florida and Arkansas. and has accepted the office. The Rev. Dr. Kemper. of Connecticut, has been elected missionary bishop of Mississippi. The Eon. Jobn Sergeant has been nominated by meeting of the cilizens of Stark County. tOl friends Of Gen. HarrisOs, fOr the ofics OfVice Prssidsna The Rev. Sereao E. Dwight, D. D. has sesieDsd the Presidency of Hamilton College."
9_1835-10-01_p1_sn84020071_0041418294A_1835100101_0161,Litchfield enquirer.,01,1835-10-01,p1,DEFERRED ITEMS.,,"King; but nothing is said of their coming to America They are passing the honeymoon at Oakham Park, his lOrdshps seat near Ripley Il is sai the noble lord received with the hand of his beautiful bride fortune of G3O,OOO. Lady King will also eventually inherit the extensive Wentworth and Noel estates, in the counties ot Leicester aud Warwick, which are pos- sessed by Lady Noel Byron, the heress of the late Sir Ralph Mlbanke Noet. Bart. (by the Hon. Judith Noel, eldest daughter of Edward first Viscount Vent worth) . t -. ft.@ -...'..i f..e r.t

 Ere ot Ni6lO's Gnrden-nnd loss of Hte,-We re. gret learn that the indefagable Mir. NbIo has met with severe loss A fire broke out yesterday, a, I2 o'clock, in the building at the north end of the main house. used for exhibition, and in part by Mir. Hail. for preparing Fireworks. The fire was caused by the bursting of bottle of composition called crimson re from spontaneous combustion, large quantity of fire works immediately exploded, aud Mr. Hall and his men narrowly escaped. The explosion destroyed the house and every thing it con,aned--ihe flames soon extended to the main building; regret 60 state the damage was very great; much valuable furniture banded out oft the windows and saved, but great por- ton oft was destroyed together with the whole in,e. rior of this great house. The magnificent painting of the departure the Israelites from Egypt which be- longed to a Mr. Wright, was destroyed. One of the colored walters being cut off from any retreat, was burnt to Ceath in one Of the upper stories.

 ...rss. ~. Y. Advertiser.

 Melancholy.-The wife of Mr. Samuel Story, of this city. hur""ed to death Tuesday evening last by the taking fire of her clothes She was alone tn her room al he time of the occurrence, end expired soon after assistance reached her. It is supposed tha. while attempting to close a window, the flame of a lamp communicated-.o her dress.

 Nor4oich Repu6l;cnn.

 Of all places in the world which a man would se- lect for taking nap, should imagine that bed a. the tracks of rail road be the ast And vet find 1t stated that mao was recently run over on the Ponchartrain rail road while lying asleep in this identical position.

 Bodies found British Consul at Tangiers has written to Lloyds. that l8 dead bodies Of Christians had been found on the beach. Some of the bodies were found handcued and all of ,hem had been sab- bed in various places. All the bodies appeared to have had ma""acles them; but the natives had ta- ken them off for the most for the value Of the iron.

 A gentleman and his lady made move 10 the West. After short sojourn they made another move, the also-and aer that the ,hird-slill ward It during the third move that the narrator happen. ed fall in with this family He referred to the east the home they had left, and inquired if it would be agreeable to revisit them. The lady with all the ai- achme of womnas heart the husband of her love, resolved however to continue in his company, lead where he might But shaking her head, ut the pros- pect of another move she said, amdst all 'his have one consolation, and that is derived from tho circum- siance that his earh is round, and by Keeping ,Oe shall get to Boston at last!

 Angeiic Matrimony.-A young man named Thomas Gill, the son ofan nnkecper at Sarum, England, has just married Miss Augel inc sole heiress of the grea, Angel estates in that country. The property of which he will come into immediate possession amounts to than ,000O O00i. pound sterling, 400 900! The lady is moreover young and beautiful. The Ea. vored bridegroom drove mail cart unt the day of his wedding !!-N. Y. San.

 Rererse of Fortune Major Noah says"" How oE ten have we stood in Broadway and seen with pride the nurse who carried us in her when were infant roll by in her splendid carriage, and eqnp. age. She good girl and married in our fathers house to an honest but poor man. who became rch.""

 A tragical affair occurred at No. 6 Monroe street, N. Y. % Saturday morning. A man residing there, returning home fnund his domestic rclaiions in- volved in manner most likely to arouse ,he jealousy of husband 10 the highest degree. He shot she of fender dead the spot. and then hung himself; hut the rope was cut for the accomplishment of his object ia this respect.

 By observation made at Newport. it appears that the month of August last, nearly degree cooler than August of last year, degrees than Au- gust 133 the coolest in the last l8 years. and deg cooler than August ls2O the in the same pc. riOd.

 TMrkies sOOvkiRg JOr livipg.-A -shrewd man will turn every thing good account. Here is a case, for instance. farmer in this town had fine field ofru. ia baga, which overrun with grasshoppers, eat ing of the leaves and threatening the enlire desiruc- ton of the crop He procured drove of turkies and turned ,hem into the lot and they made mince- meat of the grassboppers. The ruia hagas saved and the turkies in good case"" for any mans Thanks giving dinner.-NorthampEOD Cowrier.

 Five thousand dollars reward has been offered by of the legislature of Mississippi, any person persons who shall arrest and bring to tra mad prosecute conviction under its laws any per- son who shsli utter, publish or circulate within the

 limits of shat Siate the Lberaior, any other psper circular pamphlet, letter or address of seditious character. +

 The editors of the Newburyport Herald state that they have seen letter from Alabama, relating anoih- CT dss racefu instance of barbary in Lynching re- spec.abe clergyman, formerly of Essex couNiy, for preaching his sentiments the subject of slavery Tie accoun, says, ""ihe Rev. ). Warres, clergy man from Haverhil, I learn, from what deem good authority hung few days since in Louisa5a. for"
14_1835-10-01_p1_sn84020071_0041418294A_1835100101_0161,Litchfield enquirer.,01,1835-10-01,p1,,,"

 a succession of falling cascades, seemingly frozen in their descent, and looking like ice bergs formed of sheets of water that but moment ago were dashing in thunder down that immense height. Without pretending then to carry you along fror room to room, as each occurs, 1 let me allude to but two others in .detail.- The first shall be the Music Room, where two large sheets of stalactite fall from ceil- IDg to floor, upon one of which if you strike your hand or foot most mellow, deep,and euphonious sound is produced, as of the beat of the drum-on the other the same process causes the hollow ringing of Chinese pipe. Then there are success sion of small stalactities, on which if you strike with a small cane (do not strike too hard, or you will break them, for they are

 made of the tears of the rock, you elicit the music of the Pandean pipes to perfsc- tion. We sung several patriotic airs here, and the guides accompaniment on the drum, with the occasional bass chords of the Gong, aided by a symphony on the Pipes, really added wonderfully to ths effect. K. ys..%.t ,as .<a, Finally come with me (for this4narration must needs be dry to those who cannot see the beauties and wonders we are contem- plating) to Washington's Hall-a long a. partment in the middle of the Cave, .26O feet long, 20 feet broad, and over 30 feet high. 1t is perfectly level, regular and straight, and in the exact centre of it, there is very large pile of calcareous matter, formed there by Nature, without the least accession of the aid of Art, about or 10 feet high, strikingly resembling . statue of Washington in classic costume. The ef- feet is perfect; and taking every thinginto consideration, renders this one of the most interesting apartments in the cave. .s. 1 The guide. by patient labor sometimes obtains splendid stalactical and chrys.ali- zed specimens from almost inaccessible points in the rocks. Some of these he showed us far more beautiful thsn any sspe- cimens of foreign spas I have ever bcheld. l After spending nearly the whole day in

 the exploration, we wended our way again

 10 S,aunton delighted with the accident,the

 fortunate occnrrence ofwhich had compel- led us to seek for amusement in the re- searches of Weyer's Cave,'' a O.,

 Loss OF FRIENDs.-Our very hearts die within us when sickness and death 'as- sail our beloved friends. When the heart on which our image was engraven, and which beat with generous affection for us, is insensible and cold-vhen in that dark I and narrow bed, from which they cannot rise, sleeps father, wife, child, a friend, we feel sorrow which refuses to be comforted. We dwell upon their ex- cellencies with mournful pleasure. We think of the happy hours we have spent in their socicty-hours never to return-with a feeling which nearly approaches to des- pair. IhGf they are no nOre-that they have ceased to think, to feel, to act, at least for us-that the eye which used b gladden. a. our approach is dark, and can no more beam upon us with the cnunsels of Gisdorn, or sOoth our souls with the accents of hal- lowed and virtuous affection, is silent for- Z ever-no more to solace us in sorrow, no more to excite or heighten our pleasures. while these thoughts press upon the mind, 7 (and on the loss of our dear and vrtuous friends they do necessarily press upon it, sinking it to the dusf) the universe is a

 blank to us. No longer do we discover z any traces of that supreme and unchanging goodness which we had been accustomed to contemplate with delight. But even in these moments of sadness, we must be un- o just to ourselves, and 10 the A Author of our ? mercies, if we are not soon revived by the 7 consciousness of benevolencc, to which the severity of anguish may, for while leave US insensible. The privation ofour friends, affective as it is, is never without benefit to US. It is then that we feel that we are

 born for immortality that the world is not z our home; that we are travelling to fair CT cline. It is then that we. enter into , religion, and feel its genuine spirit. The

 same happy effects are often produced by

 sickness and to natural and moral disor-

 ders which prevail, we owe tlie production !. and growth of the excellencies of our na- t1rs. In word, an attentive considera-

 lion of what are termed the evils of life, enable us to discover so much of the truest

 benevolence in many of them, as may we'll

 induce us to bear with resignation. those whose design we cannot fully comprehend, : until it shall please our Heavenly Father to give us clearer light and stronger vision. . Smith OF Divins Goodasss. Walsh asks"" Are we under government of laws l. or not ["" Certainly we are--commOn aw, statue

 law. and Lynch's law.-C CinciHnat Rep. gs3 q Y Mothers and DGughters.--It was a ju- dicious resolution of father. as a most ] nleasing comDliment tO his wife when on"
2_1835-10-09_p2_sn87062070_0039334295A_1835100901_0979,The Arkansas advocate.,01,1835-10-09,p2,,,"A man by the name of woolly was lately caught, at Erie, Ala, attempting to decoy away some negroes. He was handed over to the Committee of Vigilance. The commit tee suspended the writ of ha5eas corpus, for the time being-and on Monday morning, it beng tae yfrst day of the Circuit Court, Court adjourned, to give precedence to Judge Lynch' and the criminals was whipped pro- naiscuously."
