article_id,newspaper_name,edition,date,page,headline,byline,article
1_1857-01-03_p2_sn93052998_00279557359_1857010301_0218,Butte record.,01,1857-01-03,p2,,,"ROAD TO THE JUNcrIoN.-Those who are
petitionipg for license to establish ferry at
the Junction, should circulate a petition to
that fleet, and give the rsidents on the east
side of tie North Fork an opportunity 30 sign
it Every resident of that vicinity would do
so, and more than y thousand signatures can
be obtained in 0royille and its vicinity
They can make demonstration that the su-
pervisors will not pass in silence, if those
interested will exert themselves,
1t is important to 0roville to securs this
road. and it cannot be done by laying idle.
Let the people make an expression upon this
subject. and they will throw off the influence
that has hung like a nightmare over the
county, prostrating her energies, and de-
vouring her resources. Circulate the docu-
ments and give Orov.lle the benefit Of such
natural advantages as her location may pos
sess.


By actual survey, the distance from hence
to Jacks Ranch is only nine miles, whilst as
the road now runs, by Lynchburg and the
Miners Ranch, it is nearly double that dis
tance."
31_1857-10-03_p5_sn82014998_00279557967_1857100301_0163,The Placer herald.,01,1857-10-03,p5,Gentlemen's List.,,"


Gentlemen's List.
Aitken John Arlington John
Armstrong
Booth Garrett Barsdbll Chester
Blanchard Albert-2 Biswell Norville B.
Balance Silas C--2 Backlum George
Baker Frank Barlow Alexander
Boire Adolpise Barker Joshua
Burgan John n. Brown Jesse S
Crews Matthew Clark Jos 'ph d.
Coward John Carpenter Calvin
Colburn Jacob Corbett James
Curl Geo w Cummings Alexander
Colburn j G Carcky John
Drake Nathan-5 Davol F
Cavs Marquis Dunhame rohn
Davis Green Durkell John
Davis G.. b Dckenson Chas NJ
Davis Wiley Devaughn William
Dunn Daniel DotyH
Emory Jesse B. Eames Alfred
Elmer Anton Elderkin Nelson
Ely John
Farr Benjamin A Fisher Amos-3
Gage J. Davis Godfrey Chas
Garner Jese G Greaey James
Hall Wm-2 Hilleary B. r.
Hill r H Higgins H H
Hopkins W. H,-2 Hauly Timothy
HagOOd Joel Hudson Mr.
Hambleton Henry Hough Noah
Hamelton DR.. A. II Halpin Michael
Hambleton Wm-2 Holland Thos
Hogan Z Hasson Thomas
Henry Moses i Harmon Roson A
Aartzell VIM
Iversen Jesse
Just J P. Jones N. P
Jenkinson Robert jackson AlonZo,
Hates Josiah p. King Nathan G
Kilgore John G
Lynch John-2 Levy Samnel
Lyme David-2 Larkns Curtis
Lane @. w. Lyons Thos
Liniger John Latroce VIM
McCarty Danel-2 Mills B. J.
McCarty Michael Hills O.P.
McGregor Archibald Mace James
McComb John Morrow VIM
McCollow Jabob S. Moore Nelson
McKeone John Meyer Hiram
McJones Thos Morris David
McIntre Thomas Miller P. Croney
Mills Hulin-2 Moran William
Newman Hon G C
Page John Price William
Peek Stiles
Quinn Peter
Ritter James Root Jas Bricc.
Roach Amos
Smith w Schlassman John
Smith Stephen u Squlres WIN
Shuck Revd Stetson Francis A
Stevens James Stoneberger Simeon
Sloan Sylvester II Sims VIM
Stewart John
Taft Walter Thompson Thomas
Todd Jacob Turowzki l. A
Union Quartz Mills, Ame- UT Henry


rican Bar.
Williams Hardy-4 Whielden Geo.
Wilks Coleman Warner G w
Watt G. II Walker William
White d Holiister Wardell John


Ladies List.
Mrs. 4. D. L. Wheaton. Mrs. Esther MoCarty
Mrs. Julia A. Flemming Miss Jenny Moore
Mrs. W. z. Cregue Dlanna jackson
Miss Ann Crutch6eld


Foreign List
Heinrich Schroder "". B. ParaSio
Jos Baker, Mr.. Asn,us Asmuseen
Jorgen Fl. Thousen AL Seignor Constantic
Al Sigr Luigi Pajola Tamboni.
81. Dcn Jesus Orosco-2M Thomas Dosithia


n. GORDON, p, NJ"
9_1857-11-25_p2_sn82006534_00415661083_1857112501_0774,The Washington union.,01,1857-11-25,p2,,,"DEArH or HoSs WAIaR CoLEs.-Captan Walter Coles,
for many years representative in Congress from the
Lynchburg district died at his residence in Ptsyvana
county the 9th instant after illness of four
or five days. He about 6s years old. Capt Coles
entered Congress in 1885, and remained member of
that body until he voluntarily retired in lS45 He
member Of the Virginia legislature in 1888 34 Du-


ring the Of 1872 he held the Office of captain Of dr


goons and served upon the northern frontier under Gen
Wade Hampton, of South Carolina He acted for long


series Of Justice Of the peace under the consttu
tion of lS30 ~ ~. ~ Il"
71_1857-06-23_p2_sn82014282_00414212438_1857062301_0148,Arkansas true Democrat.,01,1857-06-23,p2,,,"MoB LAW REPUDIATED.-The grand jury of Louisville have indicted for murder fifteen per sons, and all they could discover as participants in the recent lynching of four slaves"
7_1857-01-06_p1_sn86058106_00279557153_1857010601_0015,Oroville daily Butte record.,01,1857-01-06,p1,"NUMBER ll0.

LEGAL NOTICES.

SUMMONS",,"STATE or CALIFORNIA;


County of Butte.


Ninth Judicial Cfs'rir Court. December Trfui-- Dr.


center 24d 1851


Wm. IIaSlev aud e. II. simpkms,l


1homas l. Edwards
1T is ORDERED nv TIE CnURT-That the sur,-
mons Tor the defendant rer""in, b"" published ~
u.c Bate Rec""rI, II he~sp""rrr published in Butte
county onc, ""a week tor h. -Iacc ut liiiry days.
Attest: the foregoing true copy Of the original
order for publication of summons ia tho above enu-
tied cause now VI record. IN my Office.


Witness my hand and the seal of said District


Court affixed. This the twenty fourth day oi
lis December, A ID 1886, at Oroyille.


NILES CHAPLIN,


District Clerk,
by VI. II. DARRAcH, Depmy.


County Of Butte. }Nuth Judicial District.
VIM. lIawley and {. H. simphin' plaintiffs,


Thomas L. Edwards }Delendani.
The people of the State of California


To Thomas l.. Edwards GREETING:
NOU ARE HEREBY COMMANDED to appear
ID and answer in said Court, the complaint of said
plantiis on he in my office against You, WITHIN ten
days after the service Of this wri upon you. u served
in Butte county, within twenty days if served in any
other county OF this Nuih judicial District and wi,h
in forty days II served out OF this Ninth Judicial Dis
trict or default herein viii be entered against You.
This action is brought against you 10 Obten judgment
for two hundred and seventeen eighty onehundredlhs
dollars and interest thereon from the Sth day of jan
uary, 1856 due note given by you To j. nenella
order, November 9Th, 1855; ard for the sum OF
nine hundred and twenty-five sevealy four one hun
dredths dollars due account for Goods. Wares, and
Merchandise purchased by you Of plaintiffs, between
October 2Ith. 1850 and November 2lth 1899, and Tor
foreclosure of mortgage on the American Hotel, and
lot which the same is located, in Lynchburgh,
Butte county, given by you To secure The pay ment OF
said sums. And plaintiffs notify you that if you fnli
TO answer their complaint as herein commanded,
they will take Judgment against you by default for
said sum of two hundred aud seventeen eighty one
hundredhs dollars and interest,"" and five hundred
and twenty-five seyenty-four one-hundredhs dollars,
and interest thereon ironi the day of judgment d.
1885, until paid, and for costs ut this suit Hereof
fail not AZ your peril


Witness my hand aud Seal Of said District


Court at Oroviilo this the l2ih day Of Dec m
IL - ber, \ u ls56. MILES CHAfiN,
by VI. II. DARRAcH, Deputy. district CLERK.
12i-hNd"
5_1857-11-13_p4_sn86058106_00279557141_1857111301_0458,Oroville daily Butte record.,01,1857-11-13,p4,United States oi America.,,"ESTATE OF CALlFORNlA, Justices Court


CouNTY oF Butte \iiamiiton Township
The People OF the state Of California 10 Charles y.


Hubbert GRFrTING:


N7OU ARE HEREBY SUMMONED 10 appear
Il before me. ut my Office, in Hamilton Township
County OF Butte, on the thirty first day Of October
A. u 1857. at 10 O'Clock. A. NJ =, TO answer unto the
complaint of Geo. n. Lynch Co. wh0sne 20 recover
npe sum of one hundred and foIrtcen fifty one hnn-
dN,ifhs dollars, claimed 10 be due on account for
rant, te-s baard bill and money loaned when judg'
meI4 viii be taken against you for the said amOnnJ
together with costs and damages ii you fail to up.
pear aud answer


To the sheriff or any Constable Of said County
Greeting Make legal service and due return hereof
Given under my hand this 18th day of October, A.
d. 1857 JAMES. :. GRAIN, l.. :


Justice of tho Peace for said Township.
II ia hereby ordered. that service be had in this
cause By pub icaton in the Daily Butte Record two
weeks.


Gwen under my hand, this 18th day OF October, A.
n 1871 JAMES ). GRAIN.
olJ-2w Justice Of the Peace."
40_1857-04-17_p1_sn82016488_00513688039_1857041701_0446,Arkansas intelligencer.,01,1857-04-17,p1,,,"(RiNG in your Lard without delay the highest
- market price paid IN cash or barter by


march 27th, '57. MLYNCH"
20_1857-12-11_p4_sn86058106_00279557141_1857121101_0554,Oroville daily Butte record.,01,1857-12-11,p4,UNITED STAIRS OF AMERICA,,"UNITED STATES OF AMERICA.
Estate OF CALIFORNIA, Jusices Courl-


County up BUTTE. Hamilton Township
The People of the state of California Charles b.


IIubbert GREETING:


NToU ARE HEREBY SUMMONED to nspear
n before me. at my office, in Hamilton Township
County of Butte, ON the thirty hrst day OF October.
A. u 1857 at 10 O'Clock, A. NJ To answer unit o the
complaint OF Geo ~. Lynch Co .who sue u recover
the sum of one hundred and fourteen tlty one hun.
dre'ihs dollars, claimed to be due on account for
ranch tees baaFd bill and money loaned, when udg-
ment will be taken against you for the said amonnI
together with costs and damages, If you fail to up.
pear aud answer.


To the Sheriff or any Constable of said County
Greeing: Make iegni service and due return hereof
Given under my hand this 10Th day of October, A.
ID. 1887. JAMES. :. GRAIN, L. 81


Justice of the Peace for said Township.
II is hereby ordered. that service he had In this
cause by pub caiion in the Daily Butte Record two
weeks


Given under my hand, this 18th day OF October, A.
ID. 1857. JAMES s. GRAIN.
ol5-2w Justice Of the Peace."
33_1857-07-28_p1_sn82014282_00414212438_1857072801_0167,Arkansas true Democrat.,01,1857-07-28,p1,"BY AUTHORITY, Public Acts of the Thirty-Fourth Congress Ot the United States. First Session.

PENNSYLVANIA.",,"or the Unlted States, First Session..

 AN ACT to establish certain Post Roads. De it enacted etc., That the following be establish ed as post-roads

 PENNSYLVANIA.

 From Bristol, via Londebaugh'~ Corner. Oxfo,d Valley, Summerve and Ashland to Dallington From Bethlehem to Bath.

 From New Castle. via Brooks Harlandsburg and peian Grove to Centervile, Stepping Rock, Post Office.

 From Briston, by Londe Berough's Corner. Oxford Valley, Summervie and Oakland to Dalington. NFrom Bristol, via Centreville and Falls to Yardle- vile.

 From Shakelegville, via Londy Creek and Luttons' Corner to Evensburg.

 From Reading, in Berks county, to New Holland. in Lancaster county.

 From Staddardsville, via Clifton to Summerville. From SaXonburgh, via Cvpher's Cross Roads and Winfield Furnace to Slate Lick

 From kttaning, via Davis Knoxville Rural Will lage to Dayton.

 From Brady's Bend, via Millers Ferry and Black Fox Furnace to CallensbU.g.

 From Worthington to Millersburg.

 From New Washington via Mller's Store Hor- tons and Neals Mill to Punxsatawney.

 From Southwest to Garland.

 From Callensburg to Remenburgin Clarion comfy From Morrisdale to kylartown.

 From PunXsatawney, via Speankles Mill to Plea santvile.

 From Laporte, via Eaglesmen, Forkville Edreds From Brady's Bend to Miller's Eddy. From Wind Gap P. O., by Bushhill Center to Moorstown F. o.

 From Indiana to West Lebanon in Indiana county. From Centerville. Penn's Creek P. o.. \ throuGb Mercers Valley to Middle Creek P. o.

 SOUTH CAROLINA

 From Natural Grove to JohnsonviIle. From Gorkyille to Lyons Store North Carolina From Jetfereon F. O., via Neil Graham's Blake neys Bridge. Lynchwood and Perkins to Camden n From Lexington Court House, by Sawyers Mills, Bull Swamp to F. Nj. Rastes etc

 From Camden, via etlorson, McCroghan, Chester field. C. II. to Cheraw. From Ninety six Depot, via Coopersvlle, Grove Hill to Richardsonve.

 From Ritching's Mills via Robert Garvin's ir and Neil Ablis to Rishe's Store.

 TENNESSEE.

 From Seversvlle to Straw berry Plains. From liilsboro, by Prairie Plains henley's Store to Deehard Franklin county

 From RllsselsNille to Sneidsville Livingston.

 From Concord. via Scarborousth Mills to Pnhar+s vile '0 -''''''0- From Post Oak Springs to Yellow Springs. From Waverly to Dover by Magnolia in Stewart From Straight Fork to Snyders.

 From kuSSel!ille via Spring ale and Warrens burg to Conoy Branch. From Springhill, via vasta's Fan Yard and Santa te. to W illianSpOrt.

 From SPeedwell, via Clearfork to Boston. Ken tucky.) iNo'i r From Lebanan to Cookyille, via Gordensyille and From Concord via Lowe's Ferry r. O.. and Lor- isvIlIe' Marysyille to Mount Vale springs From Messy Creek. by l.eadvale and Parrotsvjlle to W arm Springs. (N. e.

 From MeMinyil!e. Tenn to Danyille. Ken. via sparta CookNie, Livingston, Tenn. thence to Dan vile "" ,""""

 TEXAS

 From Austin via KapIs Mills CannonvilIe. Pitts burg. Middleton and Curiate to Ss,crIale From ncelocE. by Owensyille, Eutaw. Polk and StGeIs Creeh to Springfield. Crockett i'0i Uo From Futaw, via Alto Springs to springfeIJ from Waco, by Birdsdale, Alton and Shernan,s to Preston's.

 From Jefferson via Linden, Douglassyille. Boston and De kalo to tlarksviile. :, F, FF2n Dallas, by Birdsve and Weatherford to From Paris. via Greonville to Kaufman. From Aus n by Gateslille, Meridian and Ward vile 70 Dallas. ~ "" N From Crockett, via Palestine and Athens to Kauf. ~ , From kaufman, via MilIwood, Spring IIiIto Bon ,, From Tyler in Smith county, by Hamburg and Teleco 10 WaNahache's, in Ellis county. From BHdVllle. via Ashland, Walnut Creelz Vil lage to Fort Belknap !"" From Alton. via Dallette Ranch Ashland Croa,,, Level to W Weathertord.

 From San Antonio to San Diego. in California. From Mckinney, via Alton to Brdyil,e. from fn AIto. m CheroEec county. by Rusk Jack sonWile, Lar~so to Tyler in smith county. From Camden, via Be,leyiew and Eerrien fin T,.lo- From lndianola. by New Braumteis and Middle ton to Fr-delitlobury

 From Chalieyie, via Lafayette, Boacon's Store to Quitman. "" From Palestine to Alto Springs.

 From l!ondef~on to Cartilage via Grand Bluff. From LlnWood. by the Rossel Place near the Fer "" on Aegce' River and Iancoek's to Noyaliis Prai lie. in Trinity ccuntv From Anderson via KeIlu,n's Sulphur Springs. to Fairfield. c From Bonlom ,i via Kentucky Town and Pilot Grove to VI Kinney.

 From sIrinetcli, by KiIlsborouch Ward, iIle For+ Nolth and Mount Caen. to Birdsville from EIrr VIA Hamburg Telico to Waxahatclie FI""'4 orlcEett'by Randolph, Calthols and Fishers From Cirks,i.le via Mt Pleasant .o Tvl,r. From Henderson, via Knoxville Larissa and Kicla poo to Palestine in Anderson county. From Austin to Fredcricksburq

 from arrant by Paris and Lake ecreeI 10 TQrniran rom .hbN'Ih' Wa Florence and Gates, file 10 Waco rom Jasper, by Andarson's Ferry on the Angelina hiyer. Motts and Joncsville in Cherokee county. From GHyeston via Richmond t. Lagrange. rF%o,n % t""HeLTIIe' r~hcr county by Lafayette Ra- con store and Rockers to Quitman. in Wood county From Austin. Via up the west bank of the Coora do to Burns Ford, from thence by Mormon Hin to Hamilton.

 From Nacoeloches hv Rainholts Caledonia and Walnut Hill {"" Carthage. in PanoIa county From Austin. via Bure>ton to GatesyiIl. From Fort Bclknap to Preston

 From Liberty Hill to Lamposas

 From sabine Pass, via Beaumont and Jasper to San Augustine. From Austin to Rpncson

 From Fredericksburg to Austin ,, rom san Augustine via Carthage and Br.wster's Blutt to Marshals.

 From La Grange in Fayettc co,ntv to Ga1vos+o, via Ri hmond. ''' From Austin to Gatesvine. Coycll county. From Huntsville via Madisonville Leona Cen vile. Fairfield and Corsicanica to Waxahatchie. From Tyler by Hamburg, BroNnsboro. Athens Buffalo Taos to Waxahatche

 From Anderson via kellem's Springs Lee Wash Dndees Wilson's Store and Hensons to Fairfield From Alto to Sumpter

 From Cedar City, via Harmon's Pine Valley to Lackfatah. Eagestown, Pytchns, Howell's Harris Mill and steIritt's to Hot Springs, Arkansas

 UTAH.

 From Cedar City, via Harmony, Pine Valley to

 VIRGINIA.

 From Morgantown, via Urlincton, Clinton Fur mace and Gainesville to Kingwood

 From Central Plains to Seven Island in the county of Furvauna.

 From Boggsville, via Spring Creek to Running Spring. From West Milford, via New Milton to Oxford. From Goshen Bridge, Alum Springs to Cowpasture Bridge.

 From Rock Creek via Mouth Gilbert Creek. Little IIafs Creek and Clearfield Fork of Sandy River to Tazwel court house.

 From near Coleman's Store. Jackson county, via Pond and Fuckers Creeks to West court house. From l'enn's Boro to North Bend.

 From Middlebourne via Mouth Elk Fork Creek and Carises School house to New Martinsville From Jackson court house, via Elk Fork of Mill Creek 10 Walton.

 From Langley, via Lewinville to Fairfield C. IT, From Sweet Spring to Stephen Hooks. From Blaunt's Store to Sinking Creek

 From Central Depot on '. & '. R. R. to Laurel"
115_1857-07-28_p1_sn82014282_00414212438_1857072801_0167,Arkansas true Democrat.,01,1857-07-28,p1,,,"From Natural Grove to Johnsonvlle

 From lorRNille to Lyon's Store, North Carolina.

 From Jetfereon P. O., via Neil Grahams, Blake ney's Bridge. Lynchwood and Perkins to Camden.

 From Lexington Court House, by Sawyer's Mills, Bull Swamp to F. Nj. Rastes, etc

 From Camden, via Jefferson, McCroghan, Chester field, c. II. to Cheraw From Ninety six Depot, via Coopersville, Grove Hill to Richardsonvine

 From Ritching's Mills via Robert Garvin's ir. and Neil Ablis to Rishe's Store"
7_1857-12-17_p4_sn86058106_00279557141_1857121701_0574,Oroville daily Butte record.,01,1857-12-17,p4,UNITED STATES OF AMERICA,,"STATE OF CALIFORNIA. Justices Court


CoUNTY tF BUTTE. Hamilton Township
The People Of the state of California To Charles B.


llubbert GREETING:


WOU ARE NEREBY SUMMONED to appear
II before me ut my Office, in Hamilton Township
County ~ Butte. on The thirty first day Of October
\. ID 1851 al ~ q clock. A. VI . To answer unto the
complaint o, Geo. 81. Lynch X Co who To recover
he sum of one hundred and fourteen fifty one hun
Gradths dollar@ claimed to be due account tor
ach iees, baard b and money loaned, when judg
uent viii bee iaA.n against you for the said amunnl,
i'-,iber win cs's and damages If you fail to ap.
pear and an>Wrr


10 The ShtrG any Constable Of said County,
Greeting: Mas isgi service and due return hereof
Given under n5 uaHd this 18th day of October. A.
\, 1851 1AAES. :. GRAIN, IL


Justice ot he Peace for said Township.
u is herety ordered, that service be had in this
cause by pub icatcn in the Daily Butte Record two
weeks.


Gwen under my hand, this 18th day of October, A.
H. 1881 JANIS GRAIN.
ol5-2w Justice of the Peace."
12_1857-01-10_p1_sn86058106_00279557153_1857011001_0031,Oroville daily Butte record.,01,1857-01-10,p1,"LEGAL NOTICES.

SUMMONS",,"STATE or CAItFoRNIA,3


Comfy OF iUtte.


Ninth Jadcia Cis'rict Court, December Term De
ccmher 2-d, 1856.
Wn. lIaYley and c. II. smpkins,
vs.


Thomas /. Edwards.
Er Is ORDERED BN TlE COURT-That the sums
z mons for the defendant herein. be published ~
iAe RaIte Recor a newspaper published IN Bn'i""
county once a week TOR the space OF thirty days.
AtlrSi: thr for, sutHI tr'ic copy ot the ""rgln""l
orcer for publication OF summons in tho above eu,i
tied cause, now of record. in my Office
Witness my hand and the seal Of said District


Court affixed, this the twenty fourth day of
lis December 1856, at Orove.


NILES CHAPLIN,


District Clerk,
BY NJ II. DARRAcH, Deputy.


STATE OF CALIFORNIA, District Court,


County of Butte. SNiuth Judicial District.
Wm Iiawey and G, IL. simpkns Plaintiffs,


Thomas l.. Edwards Defendant.
The people Of the State of California


To Thomas H. Edwards GREETING:
NOU ARE HEREBY COMMANDED 10 appear
n and answer in said Court The complaint Of said
plaintiffs on file in my oii,e against YOU, within ten
days after the service Of this writ upon You, II served
in Butte county, within twenty days if served in any
other county of this Ninth judicial District. and with
in forty days If served out OF this Ninth Judicial Dis
trlc or default herein will be entered against you.
This action is brought against you TO obton Judgment
for two hundred and seventeen eighty onehundredths
dollars and interest thereon from the Sth day of Jan
uary, 1885 due on note given by you to }. uenela
order November Slh, isj5 ard for the sum of
nine hundred and twenty-five seventytOur one hum
dredths dollars, due for Goods, Wares. and
Merchandise purchased by you ol plaintiffs between
October 21th 1850 and November !ith 1898, and for
foreclosure Of mortgage on the American Hotel, and
lot ON which the same is located, in Lynchburgh,
Butte county given by you to secure the payment OF
said sums And plaui rs notify yon that II you fal
10 answer their complaint as heren commanded,
they will take judgment against You by default for
said sum of two hundred and seventeen eighty one
hundredlhs dollars and interest, and five hundred
and twenty five seveuy-four one-hundredths dollars,
and interest thereon from the day of judgment A. ID.
1856. until paid, and for costs of this suit. Hereof
fail moi nj your peril


Witness my hand aud Seal Of said District


Court al Oroyic,. this the l2lh day OF neccm~
II. 81 ber. \ y. 1855 MILES CHAPLIN,
by VI. II. DARRAClI, Deputy district Clerk.
d26-SOd"
3_1857-10-15_p2_sn86058106_00279557141_1857101501_0359,Oroville daily Butte record.,01,1857-10-15,p2,,,"STOLEN HoRsEs.-For the benefit of those
herabout who have lost horses, we publish the
following from the California Express -
Fifteen or twenty stolen horses are at
Lynch's Ranch, sixteen miles above here on
the Yuba river road. They were stolen by
Big Charley, notorious horsethief, who
was arrested with them in his possession.
They were taken, probably from various
quarters, Unless their owners appear and
claim them within ten days, they will be
sold according to law."
5_1857-08-29_p1_sn82014998_00279557967_1857082901_0139,The Placer herald.,01,1857-08-29,p1,,,"Io,ca HH.-At retys-Inspector, Wm c.
Rich; Judges, Jacob Nef Wm. Grady


Birds Eat.-FOrd's Store-Inspector. r. r.
Bowey Judges, II. r. Rand. C. Mowry


WISCONSIN HH.--At Ell Dorado Saloon-In-
spector, Luke G. Hays; Judges, l.. r. Seton,
Robert Wispear.


Grizzly Fat.-.4t Housels-Inspector, W a.
Housel; Judges, Chas. MCGOWAN, Jacob Spindle
Humbug.-.At Old Store-Inspector, l.. p.
Burnham; Judges, E. Smithwck, J. McOmbers.
FOrd's Bar.-Inspector, j. l.. Finley; Judges,
j. Warner, W. H. Gale


Green Valley-Toll House Inspector, VIM. Ii.
Handy; Judges Isaac Mack, Geo. Sarles


TOWNSHIP No. S.-Dead,cood-Insp Dr.
Hewitt Judges, E. T. Darling c. W. Porter.
.4ntoine Canon.-Marcy' Store-Inspector W.
d. Smith; Judges, - Cook, r. Shaw.


Last Chdnce.-.4t Sinclai s-Inspector, p. G..
Hyland; Judges, Il Sinclair H. NJ. Barnes.
TOWNSHIP No. 9.-Ste1art Fat-Inspector G..
c. Newman; Judges, VIM. Larkn, Samuel J. Ray.
.NeWcasIe.-lnspector, G. w. Dale; Judges,
John Holder, e. c. Powell.


Pine Grore.-Inspector p. Lynch; Judges; l..
G. Smith, NJ. Finley.


Franhlin House.-Inspector, H. Manser; Judges
John WiXon. J. II. Prosser.


Horse Shoe Bar.-Sweet's Store-Inspector,
VIM. Gwn; Judges, Joseph Ball. Sam. S. Sweet
TOWNSHIP No. 10.-C0r's Ranch-Inspector.
Paul Cox; Judges, 7. l.. Chamberlain John Viii
son.


GrGys Ranch.-lnspector. S. B. Wyman. Judges
f. Hartord Chas. Barnhart.


BY order of the Board of Supervisors.


j. X. CATE, President."
1_1857-08-18_p1_sn82015753_00212475397_1857081801_0962,New Orleans daily crescent.,01,1857-08-18,p1,,,"OUTRAGEOUS PRANKs.-On the night of Sunday,
the 9th inst, number of young men played off some
extraordinary and highly censuable tricks upon the
congregation of the Methodist Church in Lynchburg
Va. The Courier gives the following account of the
affair:


Itappears that on Sunday night last sacregious
wretch managed to obtain to the gasmeter and
let off all the water The consequence was that the
gas soon went out, leaving the church in total dark
ness. Then it was that the same wretch, together
with his accompces, scattered many pounds of finely
powdered pepper on the floor, benches, ratings
and elsewhere. The house was densely crowded, and
after theg gas lighted again. and while the preacher
was was in the midst OF stirring appeal to the
sciences Of his hearers, the ladies commenced to ply
their fans and the persons standing in the aisle to
move about to get little fresh air. This reused up
the powdered pepper and started the whole congrega
ton to coughing and sneeZng at rate so terrible as
to put speedy stop to the services. Unable to en-.
dure their suerings, many of the congregation rose
up and made for the doors. The doors could not be
| opened There were wretches outside holding them
with ropes? How long this state OF things lasted we
were not told What the consequences must have
been we leave to be imagined,"
