article_id,newspaper_name,edition,date,page,headline,byline,article
13_1840-01-25_p1_sn82015015_00415661265_1840012501_0048,The Madisonian.,01,1840-01-25,p1,"DR.. GooDE's
CELEBRA TED FEMALE PILLS.",,"These Pills strongly recommended TO the notice OF
the Ladies as safe and efficient remedy in removing
those complaints peculiar To their SEX from Of
cse general debility Of the system, distractions sup.
pressions and irregularty OF the menses the
time, sttengthe ming, cleansing and giving the
mach and bowels, and producing new and healthy
ton throughout the system generally. They appe
lite, correct indigestion gddness and those
plants which distress females much at the turn Of
fe. They obviate costiveness, and all hys-
terca and nervous affections, likewise afford soothing
and permanent rehefn uor abus, and the obsti
nate cases OF chorosis green sickness they invariably
restore the pad and delicate female to health and yigor


These Pills have gained the sanction and appreciation
OF the most eminent physicians in the United States and
many mothers can Likewise testify to their extraordinary
efficacy To married females whose expectations Of the
tenderest pledges OF connuoa happiness have been de-
featcd, these Pills may be truly esteemed bssfl boon


They renova,e all functional debility, and if taken
according TO directions, obvate all morbid action.


Dr. Goode's Celebrated Female PiHs-are for all
the following Diseases Suppression, irregularty or
retention Of the uor albus, chloross green
sickness cosveness gravel, nconlinence Of urine
vous affections, Mysteries, poapsus uer OF falling Of
the womb and piles also, pains in the side chest limbs,
head, stomach back dimness, confusion Of sight
alternate nushes Of heat and chiness watch
ngs agitation; anxiety bad dreams and spasms. This
medicine is acknowledged TO be OF the valuable
discovered purifier Of the blood and fluids it
superior to sasaparla, whether as sudohc or atera
tive.


Agent LEWIS JOHNSON, Washington, D. c.


Interesting and applicable 10 he afflicted nth dsea.
ses of The stomach nerpes such Dyspepsia either
chronic Casual under the worst symptoms OF restless
ness; Lowness of Spirits and general emaciation Con,
sumption, whether Of the Lungs or Liver; Liver Aec.
tons Jaundice both hillary and spasmodc Costveness
Worms Of every variety Rheumatism whether or
chronic together with Gout, Scrolula pains in the head
back, limbs and side Typhus Fever; Scarlet do Putrid
Sore Throat Fever and Ague Spasmodic Palpta,ion OF
the Heart and Arteries Nervous Irritabity, Nervous
Weakness, Mysteries, Tic Douoreux, Cramps, Female
Distractions, Heartburn Headache, Cough the common
or humid al the Dry the Whoopng; Asthma Gravel,
and Dropsy.


The blood has hitherto been considered by empyrics
and Others the great regulator OF the human system
and such the dcvotedness Of the adherens thar erro.
neous doctrine that they content themselves with the
simple possession Of this falacious opinion without in
qulrng into the primary from whence fe health
and vigor emanae and vice PAIN sickness disease
and death Not so with Dr.. Hunt whose extensive re-
search and practical experience eninently qualify him
Tor the profession OF which he has been Of the
useful members lie contends land a moments rencc.
tion will convince reasoning mind of the correctness
OF his vewsthat the stomach, liver and the associated
organs are the primary and great regulators Of health and
that the blood IN vey many Instances dependent
these organs and that unless medicine reaches the root
OF the disease the superficial anodynes usually prescrb
ed serve but 10 the ravages odeeprooted
Under these convictions at the expense Of years of close
application, the doctor has discovered medicine whose
searching powers are irresistible and in prescribing is
with knowledge OF It's being radical cure in the yarous
diseases already enumerated, even if applied thc most
critical cases but he do not pretend to asGbe TO Hunts
Botanic Pills, supernatural agency, although from posi-
tive proofs within the knowledge OF hundreds he Is pre
pared to show that when every other earthly remedy has
been given up, Hunts Botanic Pills have never been
known to fail IN ehectng two very gratifying results that
OF raising from the bed of sickness and disease those who
have tested their efficacy and thus amply rewarding Dr.
Hunt for his long and anxious study attain this perfec.
tion in the healing art.


Agent, LEWIS JOHNSON, Washington, D. c.
DR.. Evans Canomlle and Aperent Pills,


"" Evans Fever and Ague Pills,


Evans Soothing Syrup,


"" Goodies Female Pills,


Hunts Botanic Pills.


are entered oceor9iag TO act Of Congress and are
rendcd oatR al 100 Chatham street. NeD York or al The
regular agents.


G. HALL, Norfolk.


f f. PORTLOCK, Portsmouth,


JOSEPH GILL, Richmond


MORTIMER < MOWBRAY, Baltimore,


JESSE PERRY, Suffolk


LEW Is JOHNSON, Washington, d. c.


M. THRIFT Il Co, Petersburg.


JONM N BELL Winchester, Va


WILLIAM DORSEY, Marnsburg Va


EDWARD MCDOWELL, Fredericksbu Va


T. BERKELEY & Co, Harrington, Va


J. HARDISTY, Harrisonburg, Va


JAMES BROWN. Charleston, Va


G. & +. DUNKUM. Lexington, Va


BARRETT < MCINTYRE, Charlottesville, Va


LYMAN, Lynchburg, Va
&. CRUIKSHANK. Gcorgetown, D. C.


BELL & ELLSWORTH Alexandria d. c. Iy20"
9_1840-01-21_p1_sn82015015_00415661265_1840012101_0040,The Madisonian.,01,1840-01-21,p1,"DR. GooDE's
TED FEMALE PILLS.",,"These Pills are strongly recommended to the notice OF
the Ladies safe and efficient remedy in removing
those complaints peculiar to their from want of
else. general debility Of the system obstructons sup
pressons, and rreguarity of the menses; the


time Strengthening. cleansing and giving tone to the sto
mach and bowels, and producing new and healthy ac
ton throughout the system generally. They appe


lite, correct ndgeslion remove gddncss and those
plants which distress females so much at the turn Of


life"" They obviate costveness, and couneract all hys
erical and nervous affections, likewise afford soothing
and permanent reliefin uor albus and in the obsi
nate Of chorosis sickness they invariably
restore the pad and delicate female to health and vgo


These Pills have gained the sanction and appreciation
Of the most eminent physicians in the United States and
many mothers likewise testify to their extraordinary
efficacy. To married females whose expectations Of the
enderest pledges of connupia happiness have been de-
eaed, these Pills may be truly esteemed blss boon
They soon rcnovaie all functional debility, and If taken
according TO directions obvlate all morbid action.


Dr. Goode's Celebrated Female Pius-are for all
the following diseases Suppression. irregularity or
retention of the menses, fuor abus, chorosis green
sickness, cosveness gravel, ncontnence of urine ner
vous affections Mysteries, proapsus uter or falling OF
the womb and piles Also pains In the sde chest limbs,
head, stomach back dimness confusion Of sight
alternate ushes Of heat and chiness tremors watch
nss agitation; anxiety bad dreams and spasms This
medicine is acknowledged to be Of the most valuable
discovered purifier Of the blood and uids it
superior to sarsapara, whether as sudordc or altera
tive.


Agent, LEWIS JOHNSON, Washington, D. c.


Interesting and applicable to tie afflicted, Nth disea-





chronic Casual under the symptoms of restless
ness Lowness OF Spirits and general emaca,ion Con-
sumption, whether Of the Lungs Liver; Liver Aec-
tons Jaundce both hillary and epasmodie; Costseness
Worms Of every variety Rheumatism, whether acute or
chronic together with Gont Scroula pains in the head
back, limbs and side; Typhus Fever; Scarlet do. Purd
Sore Throat Fever and Ague, Spasmodic Papitaion o
the Heart and Arteries, Nervous lrrablty, Nervous
Weakness, Mysteries, Tic Douloreux Cramps, Female
DISTINCTIONS. Heartburn Headache, Cough, the
or humid al the Dry the Whooping Asthma, Gravel
and Dropsy.


The blood has hitherto been considered by empyrcs
and others, the great regulator OF the human system
and such the devoteness OF the adhecnts that
neous doctrine, that they content themselves with the
simple possession Of this faacous opinion, without in
quiring into the primary from whence fe health
and vigor and vice pain, sickness disease
and death Not with DR.. Hunt, whose extensive re-
search and practical experience emneny qualify him
Tor the profession OF which he has been of the
useful members He contends. land moments re1ec.
tion will convince any reasoning mind of the correctness
OF his viewsthat the stomach liver and the associated
organs are the primary and great regulators of heahand
that the blood in veiy many Instances is dependent
these organs and that unless medicine reaches the
Of the disease the superficial anodynes usually prescrh
ed but to the ofdeeprooted maaes
Under these convictions, the expense of years close
application, the doctor has discovered medicine whose
searching powers irresistible. and prescribing 1t is
with knowledge ofits being radical in the
diseases already enumerated even if applied in the
critical but he do pretend to ascrbe Hunts
Botanic Pills, supernatural agency, although from posi-
tive proofs within the knowledge of hundreds he pre-
pared to show that when every other earthly remedy has
been given up, Hunts Botanic Pills have never been
known to fail in efecng very gratifying results, that
of raising from the bed of sickness and disease those who
have tested their efficacy and thus amply rewarding Dr.


Hunt for his long and anxious study attain this peec-
tion in the healing art.


Agent, LEWIS JOHNSON, Washington, D. c.
DR.. Evans Camomilo and Aperient Pills.


Evans Fever and Ague Pills,


Evans Soothing Syrup,
"" Goodies Female Pills,
"" Hunts Botanic Pills,


are entered according 10 act of Congress, and are
rended ontg al 100 Chatham street. Ner York. al Me
| regular agents.


c. HALL, Norfolk.


T.. f. PORTLOCK. Portsmouth,
JOSEPH GILL, Richmond.
MORTIMER & MOWBRAY, Baltimore,
JESSE PERRY, Suffolk,
LEW rs JOHNSON, Washington, d. G.
NJ THRIFT & Co +, Petersburg,
JONM N. BELL. Winchester, Va.
WILLIAM DORSEY, Martinsburg Va.
EDWARD MCDOWELL, Fredericksburg, Va


f. BERKELEY & Co, Harrington, Va.
j. HARDlSTY, Harrisonburg, Va.
JAMES BROWN. Charleston Va.
c. a. f. DUNKUM. Lexington, Va.
BARRETT & MCINTYRE, Charlottesville, Va
LYMAN, Lynchburg Va.
&. CRUIkSHANK, Georgetown d. G.
| BELL & ELLSWORTH Alexandra, d. G. Jy20"
20_1840-01-23_p1_sn82015015_00415661265_1840012301_0044,The Madisonian.,01,1840-01-23,p1,"DIR. GooDE's

CELEBRA TED FEMALE PILLS.",,"


These Pills strongly recommended the notice Of
the Ladies safe and efficient remedy in removing
those complaints peculiar TO their SEX from Of
cise general debility of the system DISTINCTIONS sup.
pressions, and irregulary of the menses the
time, stengthe nng cleansing and giving tone TO the
mach and bowels and producing new and healthy
ton throughout the system generally They appe
ttc correct Indigestion remove gddness and those
plants which distress females much at the turn of
lfe They obvate costiveness, and couneract all hys-
terical and affections likewise afford soothing
and permanent reefn uor abus, and in the obs,i
nate of chorossor green sickness they invariably
restore the pad and delicate female health and vigor


These Pills have gained the and appreciation
o the most eminent physicians IN the United States and
many mothers can likewise testify to their extraordinary
efficacy To married females whose expectations of the
tenderes pledges OF connuDa happiness have been de-
feated, these Pills be truly esteemed bssul boon
They all functional debility. and if taken
according TO directions obviate all morbid action.


Or. Geodes Ceiebrated Female EiHs-are for all
the following diseases Suppression. irregulary or
retention of the uor abus, chorosis green
sickness costiveness gravel ncontInence OF urine ner
vous affections, Mysteries, proapsus uer, falling OF
the womb and piles also pains IN the sde chest limbs
head stomach or back; dimness, confusion Of sight
alternate hushes of heat and chillness tremors watch
ings agitation anxiety bad dreams and spasms. This
medicine is acknowledged to be Of the most valuable
discovered purifier of the blood and fluids it
superior TO sarsaparlla whether as sudohc or atera
tive.


Agent, LEWIS JOHNSON, Washington, D. C.


Interesting and applicable 10 the afflicted, ,oi dsea.
ses of c stomach nerUes, such as Dyspepsia, either
chronic Casual under the worst symptoms OF restless
ness Lowness OF Spirits and general emacation Con
sumption whether of the Lungs Liver; Liver Affec.
tons; Jaundceboh hillary and spasmodic; Costiveness;
Worms OF every variety Rheumatism, whether acute
chronic, together with Gou Scroula pains in the head,
back limbs and side; Typhus Fever; Scarlet do Putrd
Sore Throat Fever and Ague, Spasmodlc Paptaion OF
the Heart and Arteries, Nervous Irrabty, Nervous
! Weakness, Mysteries, Tic Douloreux Cramps, Female
Distractions Heartburn, Headache, Cough the common
or humid, and the Dry the Whooping Asthma Gravel,
and Dropsy.


The blood has hitherto been considered by empyrics
and Others the great regulator of the human system
and such the devoedness of the adheents that erro
neous doctrine, that they content themselves With the
simple possession of this faacous opinion without in.
curing into the primary from whence e health
and vgor emanate and vice pain, sickness disease
and death. Not with DR. Hunt, whose extensive re-
search and practical experience so emnently qualify him
Tor the profession OF which he has been OF The most
| useful members. He contends land moments rehec.


ton VIII convince any reasoning mind OF the
OF hs vlews-ha the stomach liver and the associated
organs are the primary and great regulators of
that the blood in veiy many Instances is dependent, on
these organs, and that unless medicine reaches the root
OF the disease, the superficial anodynes usually rescb
ed serve but to cover the maades
Under these convictions the expense years of close
applcation the doctor has discovered medicine whose
searching powers irresistible and prescribing 1t is
witha knowledge its being radical in the various
diseases already enumerated if applied in the mos,
critical cases, but he do pretend ascrbe To Hunts
Botanic Pills supernatural agency although from posi-
tive proofs within the knowledge Of hundreds he is pre-
|
been given up, Hunts Botanic Pills have never been
known to fail In eeeng two very gratifying results that
OF raising from the bed of sickness and disease those who
have tested their efficacy and thus amply rewardng Dr.


Hunt for his long and anxious study attain this perec
| tlon in the healing art.


Agent, LEWIS JOHNSON, Washington, d. c.
| Dr. Evans Camomilo and Aperient Pills,
| Evans Fever and Ague Pills,


:"" Evans Soothing Syrup,
| Goodies Female Pills,
| Hunt's Botanic Pills,


are entered aco0rdiag 10 act of Congress and are
rendcd onty at 100 Chatham street, Ne,c York or al The
| regular agents


| G. HALL Norfolk,


| E 4. PORTLOCK. Portsmouth,


JOSEPH GILL, Richmond,
| MORTIMER & MOWBRAY, Baltimore,
/ JESSE PERRY, Suffolk


LEW is JOHNSON, Washington, d. C.
| M THRIFT & Co. Petersburg
| JONM n, BELL. Winchester Va
| WILLIAM DORSEY, Martinsburg, Va
| EDWARD MCDOWELL, Fredericksburg, Va.


BERKELEY & Co, Harrington Va
| j. HARDISTY, Hansonburg Va
| JAMES BROWN, Charleston, Va
| G. q f DUNKUM Lexington, Va
| BARRETT & MCINTYRE, Charlottesville Va
| LYMAN, Lynchburg, Va
| C. CRUIKSHANK, Georgetown, d. C.
! BELL & ELLSWORTH, Alexandra, d c. y20"
6_1840-03-28_p3_sn82014892_00393342870_1840032801_0009,Southern shield.,01,1840-03-28,p3,,,"Gen. Duff Green has at length abandon ed CoIhoun He has wasted great talents and handsome fortune for the Thonest Nullifer,"" who has son that married daughter of Gen Green At a late meet ing of the friends of General Harrison in Baltimore Gen. Green publicly announced his intention to support him; he also declar- ed that it was his intention soon to estab- lish Harrison paper in that city, Tn the first number of which, he designs publishing a correspondence between himself and MT. Calhoun, which, he says, will show the lat ter to be the most treacherous man living Calhoun's little squad"" of honest States Rights men are leaving him to an ignoble and inglorious fate. ""How is the mighty fallenr' 4 Richmond correspondent of the Lynchburg Virginian gives the above statement. --Memphls Enq"
17_1840-01-28_p1_sn82015015_00415661265_1840012801_0052,The Madisonian.,01,1840-01-28,p1,"DR. GoopE's
CELEBRAT TED FEMALE PILLS.",,"


These Pills strongly recommended 10 the notice OF
the Ladies safe and efficient remedy in removing
those complaints peculiar to their from want of exe
cse general debility OF the SYSTEM Instructions, sup
pressions and irregulary Of the menses; the
time, strengthening cleansing and giving tone TO the sto
mach and bowels, and producing new and healthy ac
ton throughout the system generally They create appe
lite correct Indigestion gddness and those
plants which distress females much at the g turn Of
ie They obviate costlveness, and couneract all hys
terca aud nervous affections, likewise afford soothing
and permanent rciefn fuor abus, and in the obs
of chorosisor sickness, they invariably
restore the pad and delicate female to health and
These Pills have gained the sanction and appreciation
Of the physicians in the United States and
many mothers can likewise testify to their extraordinary
efficacy. To married females, whose expectations of the
tendeest pledges of connuoa happiness have been de-
leated, these Pills he truly esteemed bliss boon
They renoyao all functional debility, and if taken
according to directions obvlate all morbid action.


Dr. Goodc's CELEBRATED Female Pils-are for all
the following diseases Suppression .'irregularity
retention of the menses, uor abus, chorosis green
sickness cosveness, gravel ncontinence of urne
affections, Mysteries, proapsus uter Of falling of
the womb and piles also, pains in the sde chestmbs,
head, stomach back; dimness confusion Of sight !,
alternate ushos of heat and chilness tremors watch
ings agitation; anxiety bad dreams and spasms TINS
medicine is acknowledged TO be Of the most valuable
discovered purifier of the blood and fluids it
superior to sarsapara whether as sudordc altera
tive.


Agent, LEWIS JOHNSON, Washington, d. c.


Interesting and applicable 10 The afflicted, ph d,sea-
of The stomach nerpes, such Dyspepsia either
chronic or Casual under the symptoms OF restless
ness; Lowness OF Spirits and general emacation Con
sumption, whether Of the Lungs or Liver; Liver Afec
TONS Jaundlce both hillary and spasnodic Costveness
Worms Of every variety Rheumatism, whether acute
chronic, together with Gou Scroula pains in the head
back, limbs and side; ryphus Fever; Scarlet do. Purd
Sore Throat Fever and Asue, Spasmodic Papitaion OF
the Heart and Arteries. Nervous Irrtaby Nervous
Weakness, Mysteries, Tic Douloreux Cramps. Female
Distractions Heartburn, Headache, Cough, the common
or humid al the Dry the Whooping; Asthma, Gravel
and Dropsy.


he blood has hitherto be en- considered by empyrcs
and others, the great regulator Of the human system
and such the deyotedness of the adherents that
ncous doctrine, thar they content themselves with The
simple possession of this faacous opinion, without in
qiirng into the primary sources from whence life, health
and emanate and PAIN sickness disease
and DEATH Not with DR.. Hunt, whose re-
search and practical experience emnenty qualify him
for the profession OF which he has been Of the most
useful members He contends --and a moments rehec.
tlon will convince reasoning mind Of the
OF his vlews-that the stomach liver and the associated
organs the primary and great regulators Of heahand
that the blood in vey many Instances is dependent on
these organs and that unless medicine reaches the
OF the disease the superficial anodynes usually prescrb
ed serve but to the ravages deepooed maades
Under these convictions at the expense Of of close
application, the doctor has discovered medicine whose
searching powers are irresistible and in prescribing 1t
with knowledge ols being radical in the various
dlseaees already enumerated, it applied in the most
critical cases, but he do sno pretend ascrbe Hunts
Botanic ills, supernatural agency although from posi-
tive proofs within the knowledge of hundreds he is pre-
pared to show, that when every other earthly remedy has
been gwen up Hunts Botanic Pills have never been
known 10 fail in efccing two gratifying results that
OF raising from thebcd Of sickness and disease those who
have tested their efficacy. and thus amply rewardny DR.
Hunt for his long and study attain this percc.
ton in the healing


Agent, LEWIS JOHNSON Washington, D. G.
DR.. Evans Canomlo and Aperient Pills,


Evans Fever and Ague Pills.


Evans Soothing Syrup.


"" Goodies Female Pills.


Hunts Botanic Pills,


entered arcording 10 act of Congress and are
rended ontg al 100 Chaiams street, Neo York or al The
regular agents.


G. HALL. Norfolk


L. PORTLOCK, Portsmouth,


JOSEPH GILL Richmond


MORTIMER d MOWBRAY Baltimore,


JESSE PERRY Suffolk,


LEW is JOHNSON, Washington, d. C.


M THRIFT & Co, Petersburg.


JONM N BELL. Winchester, Va


WILLIAM DORSEY Marinsburg, Va


EDWARD MCDOWELL, Fredericksburg, Va.


T. BERKELEY & Co, Harrington, Va.


J. HARDlSTY, Hartisonburg, Va.


JAMES BROWN, Charleston, Va


G DUNKUM, Lexington, Va


BARRETT & MCINTYRE Charlottesville, Va


LYMAN, Lynchbug, Va


e. CRUIkSHANK. Georgetown, d C.


BELL q ELLSWORTH, Alexandra, d, C. ly20"
