article_id,newspaper_name,edition,date,page,headline,byline,article
2_1840-05-02_pNone_sn83016867_00295877637_1840050201_0551,Columbus Democrat.,01,1840-05-02,pNone,NAlLEp TO nm COTNTER.,,"


We lay before our readers a letter from Mr.
Sias Wright, Jr. Senator Of the L. S. written
at our request We saw a Wing EDecior IN Giles
county boldly asserting, hat Mr. Van Buren, had
moved this anii-war resolution. We saw Il hy.
ing at the mast head of several Wing presses 80
1t was time, We thought to arrest the circulation
of the base CON upon The best aulhoF'iy--anu
We wrote Tor WrlghtS evlJence-and here HiS'
as fiat and unequNocaI AS 'angnge can make IT,
We now call upon the Dany,ile Reporter TO take
It from its mast head We call upon the hnoN'
VILE Register to fepau Tie uJnshee mas uone
~ ils paper OF the 5lst INST we eau upon vac
Lynthourg Nirsln'an to te'faet It's oei'ei-io'
here is ""au'hrouly entitled to every c""nhdehct'
IL ~ remarkable, mat wlhlh SIX h""ois a'eI 't'
ceNng MI NHghts letter. these ihtee ne""spA'
peafsreached, us feehng WIN Toe tl'eho""d' me
reason which the LynchoutgN IGn'an assigns lVI
rIs behei IN tis indeed most amusing anu ao-
sud; VIZ that MI Van buren had gone ''f
Dewitt CLINTON, because he WAS the peace par
~ Candidate Why does he not KNOW ma,
vas exactly upon The opposite ground thsl MI
c. was brought forward Does not Mr.. Butler
~ his letter TO Mr.. Garland OF 1880, expressly
say Tho great mass oi them NJ IS
itIends,) 50 far from beng opposed 10 6sHgfaM
measures against Great Bnuan, we're IN ldvor OF
a more decided policy than Ind been pursued
towards her : But enough MIR. Nnehis let
ter ought TO remove every doubt, and arrest The
circulation of tins outrageous forgery the liHd'
.,,,, ,..,,L,,,,,r Richmond Eapu,rsr


=, ,o,n


WASHINGTON 4'h hP'''


My Dear SH - nave 'te""'o your ''u'
bringing to my notice an afuele ""hlch o''Sha'y
appeared, as understand W. III oouuf ""e''''""
paper charging M van ou,en WI""
popular anti-War meeting a' ilndson' W Tue 9""'e
oil New YORK, IN lSiZ of lSl'' """"u ""'""'""'E
resolution to The efiec' 'ha' 'he war was """"Po''
lc and disastrous, and that to employ me ""i,.''""
IN an offensive war was nnco""''""uuo""""', lou
DO 'he PRESIDENT ou, Jus""'S W '''' '''
pnlauon as ue'ug ""ho'p ue''''""'' VI '""""''u""''''
ID rum me slory o, 'he '""ee,,ns' ""'o ''"",""'
ahce ana course OF M va"" pu't""' """"o Wv
resolution 50 iofin'l} gwen ""'O H"",''
uohs' without s'hG'e circumstance ~ '""', W s''
conneha""ee 10 Tue eo'""'s'' VI P"" u'''""'' WV i""'''
leacy o' h'ih VINO ''S' S""""''N''"" .-.-.


send you hy this ma,l u pa""Pmt' e,'n'""''""p
succmc' narrative on MI ' an pnttn. course
dat'T '""e ""o' ',oI' 's' .o""'',C C a""' [ '"" ~ e,s d
II Is almost eh'neV ""an'c''l' ""o"" Puo,'' Wv
u'ne.'' ""'G ,""o'o ''',""N,' ''''' '""' a.,
y oi ""hch mere can oc no u''Pu't' py ,o'
WIN see 'i't instead !"" 'tei'o',.e VIZ -, 80
po''I .a''I anu r,,II,J
""sG9 as Ss Nh 4hn1onhnt 4hn ht 9fa@lV @ ""ftss"" IN Vt
""~r ,be h;ob ;ns,ice and ,nd,4oensabe necessity
r IL IL ,,btcb ,nr country had taken; OF"
9_1840-01-11_p1_sn82015015_00415661265_1840011101_0028,The Madisonian.,01,1840-01-11,p1,"DR.. GooDE's

CELEBRATED FEMALE PILLS.",,"CELEBRAT TED FEMALE PILLS


These Pills strongly recommended to the notice Of
the Ladies a safe and efficient remedy in removing
those complaints peculiar 10 their sex, from Of
clse or general debility Of the system obstructons sup
pressions, and irregularty of the at the
time, strengthen nng cleansing, and giving tone TO the
mach and bowels and producing new and healthy
ton throughout the system generally They create appe-
tite correct indigestion remove gddness and those
plants which distress females much at the turn OF
life"" They obvate costlyeness, and couneract all hys
terical and nervous affections, likewise afford soothing
and permanent reefn huor abus, and in the obsti
nate Of chlorossor sickness, they invariably
the pald and delicate female health and vigor


These Pills have gained the sanction and appreciation
Of the most eminent physicians in the United States and
mothers likewise testify to their extraordinary
efficacy To married females, whose expectations Of the
tenderes pledges of communal happiness have been de-
feated these Pills may be truly esteemed blissl boon
They renovae all functional debility, and if taken
according TO directions, obyiate all morbid action.


Dr. Goodes Celebratcd Female Pils-are for all
the following Diseases Suppression irregularty or
of the menses uor abus, chorosis green
Sickness costiveness gravel neontinence Of urine ner.
affections, Mysteries, proapsus ueri, or falling of
the womb and piles also pains IN the side chest limbs,
head stomach or back; dimness confusion OF sight
alternate hushes of heat and chillness iremors watch
ings agitation anxiety bad dreams and spasms. This
medicine is acknowledged TO be OF the most valuable
discovered purifier of the blood and fluids it
superior to sarsaparla as sudodc or altera-
tive.


Agent, LEWIS JOHNSON, Washington, D. c.


Interesting and applicable 10 The afflicted, nth disea-
of The stomach nerues such Dyspepsia, either
chronic Casual under the worst symptoms OF restless
ness Lowncss OF Spirits and general emacation Con.
SUMPTION whether OF the Lungs or Liver; Liver Affec-
tons Jaundcc both hillary and spasmodic; Costiveness;
Worms of every variety Rheumatism, whether or
chronic, together With Gou Scroula pains in the head,
back limbs and side Typhus Fever; Scarlet do Putrd
Sore Throat, Fever and Ague, Spasmodic Paptaion OF
the Heart and Arteries, Nervous lrritabty Nervous
Weakness, Mysteries, Tic Douloreux, Cramps, Female
Distractions Heartburn, Headache, Cough, the
or humid, ard the Dry the Whoopng; Asthma Gravel,
and Dropsy


The blood has hitherto been considered by empyrics
and others, the great regulator of the human system
and such IS the devoedness OF the adherens to that
ncous doctrine, that they content themselves with the
simple possession Of this faacons opinion without in.
qurng into the primary from whence life he ath
and vgor emanate and vice pain sickness disease
and death. Not with Dr.. Hunt whose extensive re.
search and practical experience so emnenlly qualify him
Tor the profession OF which he has been OF the
useful members. He contends land moments rcdcc-
tion will convince reasoning mind of the correctness
OF his vleWstha the stomach liver. and the associated
organs are the primary and great regulators OF heahand
that the blood in very many instances dependent on
these organs and that unless medicine reaches the root
OF the disease the superficial anodynes usually prescrb
Cd serve but to cover the OF deeprooed maaes
Under these convictions the expense OF wears of close
application, the doctor has discovered medicine whose
searching powers are irresistible and in prescribing is
with knowledge fits being radical cure in the various
diseases already il applied in the most
critical cases, but he do pretend scbo to Hunts
Botanic Pills, supernatural agency, although from posi-
tive proofs within the knowledge of hundreds he il pre
pared to show, that when every other earthly remedy has
been given up Hunts Botanic Pills have never been
known to fail in efecting very gratifying results that
Of raising from hebed of sickness and disease those who
have tested their efficacy, and thus amply rewardng Dr.
Hunt for his long and anxious study attain this perfec
tion in the healing


Agent, LEWIS JOHNSON, Washington, D. c.
Dr. Evans Canomlc and Aperent Pills,


"" Evans Fever and Ague Pills,


Evans Soothing Syrup,


Goodies Female Pills


s' Hunts Botanic Pills,


are entered according 10 act of Congress and are
uended ontv al 100 Chatham street. Ne,c York or al e
regular agents.


G. HALL, Norfolk,


f. +. PORTLOCK, Portsmouth,


JOSEPH GILL, Richmond


MORTIMER & MOWBRAY, Baltimore,


JESSE PERRY, Suffolk,


LEW IS JOHNSON Washington, D. C.


M. THRIFT & Co, Petersburg,


JONM N. BELL, Winchester, va


WILLIAM DORSEY, Martinsburc Va


EDWARD MCDOWELL, Fredericksburg Va


L. BERKELEY & Co, Harrington, Va


j. HARDISTY, Harrisonburg Va


JAMES BROWN, Charleston, Va


G. q p. DUNKUM Lexington, Va


BARRETT & MCINTYRE, Charlottesville, Va


LYMAN, Lynchburg, Va


&. CRUIKSliANK, Georgetown, D. C.


BELL ELLSWORTH, Alexandria ID. G. Y20"
28_1840-01-18_p1_sn82015015_00415661265_1840011801_0036,The Madisonian.,01,1840-01-18,p1,"DR.. GooDE's
TED FEMALE PILLS.",,"CELEBRA TED FEMALE PILLS.


These Pills strongly recommended the notice Of
the Ladies safe and efficient remedy in removing
those complaints peculiar 10 their from OF
cise general debility Of the SYSTEM obstructons sup
presslons, and irregularty Of the the
time, sengthe nng cleansing and giving tone 10 the
mach and bowels and producing new AMI healthy
ton throughout the system generally They appe
;ite correct indigestion, gddness and those
plants which distress females much at the turn Of
Ite They obvate costiveness, and couneract all hys-
terical and nervous affections, likewise afford soothing
and permanent reef uor abus, and in the obsti.
nate cases Of sickness they invariably
restore the pad and delicate female health and vigor


These Pills have gained the sanction and appreciation
of the most eminent physicians the United States and
many mothers Likewise testify their extraordinary
efficacy To married females, whose expectations Of the
tendees pledges OF communal happiness have been de-
feated, these Pills may be truly esteemed bssnl boon
They all functional debility, and il taken
according to directions, obviate all morbid action


Dr. G6ode's Celebrated Female I9iAs--are for all
the following diseases Suppression. irregulaTity
retention Of the menses, uor abus, choross green
sickness costveness gravel incontnence OF urine
vous affections, Mysteries, proapsus uer, falling OF
the womb, and piles Also pains the side chest LIMBS
head stomach or back; dimness confusion of sight
ate fushes OF heat and chillness watch
ings agitaton anxiety bad dreams and spasms. This
medclneis acknowledged TO be Of the most valuable
discovered purifier Of the blood and huds it is
superior sarsaparilla whether sudon6c aera
tive.


Agent, LEWIS JOHNSON Washington, D. c.


Interesting and applicable to The afflicted, icith dsea,
SOS Of he stomach ncrpes, such Dyspepsia, either
chronic Casual under the worst symptoms o restless
ness Lowness Of Spirits and general emacation Con.
SUMPTION whether Of the Lungs or Liver; Liver Afec-
tions Jaundce both hillary and spasmodic Cos,ivencss;
Worms OF every variety Rheumatism, whether acute
chronic, together with Gou Scroula pains in the head
back limbs and side Typhus Fever Scarlet do Putrid
Sore Throat Fever and Ague, Spasmodic Papa'ion Of
the Heart and Arteries, Nervous Irrtabity Nervous
Weakness, Mysteries, Tic Douloreux Cramps. Female
Distractions Heartburn, Headache, Cough, the
or humid, the Dry the Whooping Asthma Gravel,
and Dropsy


The blood has hitherto been considered by empyrics
and others, as the regulator OF The human system,
and such the devoedness of the adheents
neous doctrine, that they content themselves with the
simple possession of this faacous opinion, without in.
quring into the primary from whence life, health
and vgor emanate and vice pain, sickness disease
and death. Not with Dr. Hunt, whose extensive re-
search and practical experience emnentiy qualify him


Tor the profession of which he has been OF the
useful members. He contends land moments rellec.
ton Will convince mind Of the correctness
OF his ylewsha the stomach liver and the associated
organs the primary and great regulators of health and


that the blood IN very many Instances is dependent


these organs, and that unless medicine reaches the
OF the disease the superficial anodynes usually prescb
cd serve but to the ravages ofdeeprooed maades
Under these convictions at the expense of years Of close
application the doctor has discovered medicine whose
searching powers irresistible, and prescribing 1t is
witha knowledge of its being radical cure in the various
diseaees already enumerated even i applied in the
critical cases but he do pretend ascrbe Hunts
Botanic Pills supernatural agency, although from posi.
tive proofs within the knowledge Of hundreds he is pre-
i remedy
been given up. Hunts Botanic Pills have never been
known to ta IN eiectng two very gratifying results that
OF raising from bed Of sickness and disease those who
have tested their efficacy and thus amply rewardny Dr.


Hunt for his long and anxious study attain this perec
| tion in the healing


Agent LEWIS JOHNSON, Washington, d. c.
| Dr. Evans Camomile and Aperent Pills,
Evans Fever and Ague Pills,


Evans Soothing Syrup.


Goodies Female Pills,


| Hunts Botanic Pills,


are entered according 10 act of Coagress and are
rendcd oatv al 100 Chatham street, Nc,c YORK., or at e
regular agents


| C. HALL Norfolk,


| f. T.. PORTLOCK. Portsmouth,
| JOSEPH GILL, Richmond.
| MORTIMER & MOWBRAY Baltimore
JESSE PERRY, Suffolk


| LEW is JOHNSON Washington, ID. C.
| M. THRIFT ~ Co, Petersburg
/ JONM n. BELL. Winchester Va
| WILLIAM DORSEY, Martinsburg, Va
| EDWARD MCDOWELL. Fredericksburg. Va


Z BERKELEY & Co, Harrington, Va
| HARDISTY Hsrrlsonburg, Va
| JAMES BROWN, Charleston Va
| C. d f. DUNKUM. Lexington, Va


BARRETT & MCINTYRE, Charlottesville, Va
| LYMAN Lynchburg, Va
&. CRUIKSHANK Georgetown D. c.
| BELL d ELLSWORTH Alexandria d G. y20
/"
25_1840-01-25_p1_sn86053569_00415661502_1840012501_0533,The native American.,01,1840-01-25,p1,"DIR. GOODIES CELEBRATED FEMALE
~. PILLS.",,"-


PILLS.


These Pills are strongly recommended to the notice
of the Ladies safe and efficient remedy in remove
ing those complaints peculiar to their SEX from want OF
exercise general debility Of the system, distractions,
snppresons, and rreguarty Of the menses at the same
time strengthening, cleansing and giving tone to the
stomach and bowels and producing new and healthy
action throughout the system generally. They create
Appetite correct giddiness and ner-
headache, and emneny useful in those CON-
plants which distress females much at the ""TURN OF
LIFE"" They obvae cosveness, and couneract all hys-
ercal and affections, likewise aHord soothing
and permanent relief in uor albus and in the most OBJ
stnate Of choross green sickness they invari
ably restore the pad and delicate female to health and
vigor ""..


These pills have gained the sanction and appreciation
of the most eminent physicians in the United States and
many mothers likewise testify to their extraordinary
efficacy To married females whose expectations OF the
,endere.t pledges Of connnbal happiness have been de-
teated, these Pills may be truly esteemed bissn boom
They all functional debility and if taken
according to directions, obviae all morbid action.
DIR. GoopE's CELEBRATED FEMALE PILLs.-are for all
the following diseases Suppression irregularity or re-
tention of the menses fuor abus chorosis or green
sickness, costiveness, gravel, incontInnance OF nne
affections Mysteries, polapsus ute or falling OF
the womb and piles also pains in the side, chest limbs,
head stomach back dmness, confusion of sight;
alternate flshes Of heat and chillness tremors watch
ings agitation; anxiety bad dreams. and spasms This
medicine acknowledged to be OF the most valuable
ever discovered as purifier Of the blood and fluids is
superior TO sarsapara Whe,her as suoofhc OF a'e'a'
| tive. AGENTS.
| . LEWIS Johnson, Washington, d. O.
"" ... c. CRUIKsHANK, Georgetown, d. c.
| -.. '"". BELL & E>TwIsTLE, alexandra, d. c.


INTERESTING AND APPLICABLE TO THE
| AFFLICTED. WITH DISEASES OF THE STOM-


ACH OR NERVES, such as Dyspepsia either Chronic
Casual under the worst symptoms OF Restlessness
l.owness of spirits and general en,acialon Cosump-
ton whether Of The Lungs Liver: Liver Affections ;
Jsundce both Brittany and SPasmoiic; Coshveness !;
Worms, Of every variety; Rheumatism. WHITTIER Acute
or Chronic, together with Gou Scrofula Pains in the
Head Back, Limbs and Side Typls Fever Scarlet Fe-
yer, Putrd Sore Throat, Fever and Ague, spasmohic
Palpation OF the Hear, and Arteries Nrrvons lritabi
ty, Nervous Weakness Mysteries, Tic DonourenX,
Cramps, Female Distinctions, Heartburn, Headachc,
Cough the Common Humid. and the Dry or the W hoo
ping Asthma, Gravel and Drops.


The Blood has hitherto been considered by Emplricks
and Others the great regulator Of the human SYSTEM
and such is the devotedness of the aheants to that er-
doctrine, that they content themselves with the
simple possession of this taaciou opinion without en-
qniring into the primary sources from whence Lite,
Health and Vgor emnae and uice 0ersa PAIN sickness,


isease and death. Not so with DR.. Hunt, whose eX'en-
sve research and practical experience so emneny quail


y him for the profession Of which he has been Of
| the most useful members. He conends-and moments


reflection will convince any reasoning mind OF The cor
lecness Of his vewsthat the stomach liver and asso
cated organs are the primary and great regulators OF
health and that the blood in very many instances IS de-
pendent these organs and that unless medicine reaches
| THE ROOT OF THE DISEASE the superficial ano-
dvnes usually prescribed serve but as os TO cover the
ravsges Of deeproote maladies Under these convictions
at the expense Of years Of close application the doctor
| u
irresistible and in prescribing, il is with knowledge ot
its being radical in the various diseases already
enumerated applied in the most critical cases,
but he does not pretend to ascrbe TO HUNTS BOTANIC
Pitts supernatural agency although from positive proofs
within the knowledge of hundreds he is prepared 10
show, that when every other earthly remedy has been
gwen up HUNTS BoTANc Pills have never been known
to fail in efectng two very gratifying results that oil
raising from the bed Of sickness and disease those who
have tested their efficacy and thus amply rewaring Dr.
Hunt for his long and anxious study to attain this per-
lection in the healing art.


LEWIS JOHNSON. (.Agent) Washincfon, d. c.
Dr. EVANS's CAMOMlLE & APERlENT PILLS,
""EVA~ FEVER AND AGUE PILLS,
""EVANS' SOOTHING SYRUP,
GOODS FEMALE PILLS,
""HUNTS BOTANIC PILLS,


are entered according TO act Of Congress- and vended
only at 100 Chatham Street, New York; or at the rega.
lar Agents.


e. HALL, Norfolk.


E. Z. PoRTLoCK Portsmouth.


| JosEpH GILL, Richmond.
MoRTIMoRE & MowBRAY, Baltimore.
| JESSE PERRY, Suffolk.


| LEWIS JOHNSON Washington, D. c.
| NJ. THRIFT & Co., Petersburg.
JOHN N. BELL, Winchester, Ia.
WILLIAH Dorsey, Mdrns5urg. Ia
| EDWARD McDowEL, Fredricksbrg, Va.
| E. BERKELEY & Co.. Harrington, pd.
| J. HARpIsTY, Harrisonburg Ia.
| JAMES BRowN, Charleston, Vu.
c. & f.. DuNKUM. Lexington, Ia.
BARRETT & MClNTIRE, Charlottesville, Va.
| - LYMAN. Lynchburg, ""a


| G. CRUIKsHANK, Gcorgffoun d. e.
: BELL \ EsrvIsrLE> .Atssnd'as D. C. Aug"
5_1840-07-23_p2_sn84020071_00414182951_1840072301_0112,Litchfield enquirer.,01,1840-07-23,p2,,,"llnu ner mO0eI WOrIn IOILOWlHS'

 Cincimn0H GGSette.

 Anothcr Fdta1 AfrGy.--We find in the New Orleans Picayune of the 7th instant, the fol- lowing particulars of fatal rencontre, near Woodvile, Miss. fs.t.EL ~

 A serious affray occurred near Woodville, Miss. on Sunday morning, the 26th June.- As we have learned the particulars from n gentleman who was at Woodville at the time, it seems that a Col. D. Woodward, with his brother and a man named Glass, way laid carriage containing Col. W.'s wife, and two other ladies, with MT. Frazier. step son of WIS by his wife, and two or three small children. The first named par ty ordered the other to stop, and Col. W. immediately fired a pistol directly at the persons in the carriage, wounding one of the ladies in the cheek. Young Frazier then jumped from the carriage and fired pistol at Col. Woodward, wounding him badly in the face. With another pistol he lodged ball in his body, which killed him instantly. The brother of tho latter immediately shot ! Frazier in the back as he was running to tho carriage. Glass, in the mean time, had fled. A brother of Frazier, who was on horseback behind the carriage, now came up, when ] Woodward fired a gun at him, shatterlng bis arm badly with buckshot. At the last accounts the Frazier who was first wounded was not expected 10 live.

 One of the ladies in tho carriage showed great presence of mind, by ordering her chil- dreA to Lie down. She then picked up pis- 1 tol which had been dropped, and threatened 1 to shoot one Of Col. WIS negroes, who had seized the horses, induced him to let go, and ] then drove off. .... l It seems that there had been difference of long standing between CA Woodward and his wife, in which her children by a for mcr husband, the two FraZiers, had taken part. reward of $500 has been offered 1 for the apprehension of Woodward's brother. who is now at large. Glass has been apprc- hended and is in jail.

 Murder-John B. Slaughter murdered Jo- seph w. Pledge, in Blandford, on Thursday last, under the following circumstances 1t appears that few days ago, Slaughter, who had been a troublesome character in our town for many years, received an anony. nous letter, warning him to leave town in twenty days, under the penalty of being lynchcd. Pledge, understanding that he was accused by Slaughter of having written this letter. called on Thursday, at his door in BaM}ford, and demanded of Slaughter his reasons for charging him with the authorA ship of the ssttcr Slaughter repeated tho charge, and added some words of abuSe.-

 

 the continued abuse of Slaughter, and alight- ing from his horse, threw a brick at SlaHgh- l ter, which did not strike him-whereupon Slaughter advanced on Pledge, with pistos in each hand, Pledge at the same time req. l treating, and when within a few paccs of him fired and gave Pledge wound of which he died in the course of an hour Slaughter was arrested tn a few minutes after he had committed the deed, and is now in iail

 Pinsburg Pa. Intel.

 ""7sR him he must Crop !""-We find the subioiu- cd epise in the !"" Log Cabin Ritle."" l, is we'll de- haitne sign of distress in the Loco Foco lores In. obedience to the signal thus thrown omi, shall pect 10 hear the Argus and all the of the party ] tune.

 INDIANAPOLIS, June 12 Is4O Mr. Sebnsti1n: Dear Sir-l have been informed IVY ,lenrra that in one part of yonr country thirty Van Buren men have turned for Harrison. Please e, me know if such be the fact. Hand this letter to cannot exist. Y so wiU uisit Hancock and address ie f,e rcntue to he pocv of the democratic party. have n"" time 10 spare but I~A refuse to eat or sleep en's s""ke sir ""p 'he dtnn""cracg See Champ'""n-teN him """"t to do as he did hereeSre. He used to create unnecessary al.r,ns, by putting bad face npo"" pros7 ects. Tel! him he must CROW. We have had much to crow (over.)

 Twill ensure this county to give democratic majo- ritv 0f 200 votes m~..

 

 n,,..,, GEORGE PATTINsoN,""

 Too Cooorfo be Iost,'-A correspondent at New Brunswick writes this morning that ""as the iraiA of cars from Philadelphia bringing Col. Johnson, was l approaching that ely yesterday afternoon. the Van Bnren men, with what small force they could muster. assembled at the Dep"" to rece,ve him. Afer being introduced to those who were presenl-A majority OF { whom were Whigs-Col Zabriskic who seemed o take the guest under his special charge. proposed toast ~1he health of inc real hero of the Thames to which MT. c. F. Mundv added, !"" Gen WiHiane IT, Harrison, of Ohio"" Tho toast thus completed received three hearty cheers

 | This p""pmlar turn to the sentiment was probably moi gratifying to the people than to the dis;n gnished guest, who has taken several opportunities during hs present journey to rebuke the miserable rmpts o his party 10 dsparage the character of his brave old chief and companion in arms. It is said that when the cars arrived at the depot m this city, I plain introduced himself tO the Colonel and in- qnired if Gen. Harrison was really in the battles .f brave man as ever lived !' was the prompt reply. | NetpGrk Adp l MR. CLAy.-We find in the American, in the res port of Mir. Prestons speech at ElzaLelh,own, the | following beautiful aluson to MT. Clay:

 Now as in the days of '76. the opposite of whig is tory, and IS the Tories you to overthrow fathers did. Be earnest, thep in the contest. Ynu have gallant leaders and brother soldiers. There is Hurry of the West, (.he annunciat0R of this name rapuF0uslv cheeFed.) the gallant magma nin,Ous Harry of the Vest barring his hnsom to every shaft, interceptng from his party every poisoned arrow. scared all over with wounds received in defence of his friends, and his and their principles Wth iau, relied brow. is not with the victors chapet-lhere is he-wiihout envy, without repining yielding prece- dences to another, and spreading lViRion Hem "" H""rrsoa the flag of rhe Union. bids him give it to"
