article_id,newspaper_name,edition,date,page,headline,byline,article
7_1857-09-09_p4_sn84026881_00279557268_1857090901_0236,The Nevada Democrat.,01,1857-09-09,p4,,,"THE MOB MURDER IN IowA.-It is time that
the lynchings which have recently taken place
in Iowa were called by their right name. The
hanging of William B. Thomas, in Montezuma,
was as foul murder as was ever perpretrated
by midnight assassin The Oshkosh Herald
gives the following additional particulars of the
event:


""No sooner was the decision of the Court CIV
en- [changng the venue, in order that he might
have fair trial. than a regular organized mob
of about two hundred men proceeded TO the old
court house, where the prisoner was confined,
and demanded and by force took Thomas from
the custody of the sheriff, and amid the terrfy-
| ing shrieks OF the prisoner and the most hellsh
revelings of the mob. carried him away to q
tree which they had previously prepared, in the
suburbs of the town. Here, without even ad-
herring to the customs of lynch law, or abiding
by the honor of mob force, they placed the rope
around the prisoners neck, and demanded q
confession of the crime The prisoner plead his
innocence. The rope was drawn over limb
and the prisoner swung into the air. After
few struggles he was let down, and again de-
manded to make confession. Again he plead
innocent Of the crime. Again he was hung up,
and fire kindled beneath his feet. The mob
threatened to burn him if he did not confess the
murder Again he was let down. From the
strangulaton received he had lost his strength
and his voice. The mob still demanded con
fesson The prisoner, in the faintness of death,
persisted that he was innocent Again he was
hung up, where be remained until he was dead.


The Herald says that this makes the tenth vic
tim of mob violence in Iowa since the first Of
April-four in Jackson, five in Cedar, and one
in Poweshiek."
3_1857-05-01_p4_sn82016488_00513688039_1857050101_0457,Arkansas intelligencer.,01,1857-05-01,p4,BOOKS. sza Aszsv BOOKS.,,"I fTE are now in receipt of large assortment
of boo Ks, among viii: h may be found the
lowing, vi


LiPpincott's PronOuncing Gazetteer of the


World:


Wsbsters Dictionarv-unabrf brfdged;
Woods Practice of Medicine;
Chambers Information of he People;
Romance of Natural History;
Ainsworths Latin Dictionary:
stas-buTy's ExpedIlSoo to the Great Salt


Lake:


Goldsmith's Animated Nature;
Encyclopedia of Geography;
Adventures IN the Ozark Mountains OF Mis-.


seagi and Arkansas;
Fields Scrap Book; War oi Independence;
Theirs History Of the Con-ulatc and Empire


ofNaPoleon; The Home Garner;
Autobiography of Doctor Caldwell;
Sears Wonders of the World;
Sh akeSpear's Works: Bvron's Works;
Anthous Virgil; Anthons Latin Lessons;
Anthons Cesar; Davis Legendre;
Bancrofts History of the United States;
Lynch's Dead Sea; Burns Works;
Rollins Ancient History;
Cooper < Thompson's Political Works.
Moons Poetical Works; Looking unto Jesus;
Rogers { Campbell's Poetical Works.
United States Dispensatory;
Iemprieres Classical Dictionary:
Wheelers History of North Carolina:
Meals History of the Puritans;
Family Monitor; JoSephus
Incidents of travel in Yucatan:
Central America, Chiapas Yucatan:
Last of the Huggurmuggers;
Japan by McFarlane; Ruth Hall;
Toiling and Hoping; The Creole Orphans:
The Hidden Path; Women Of the Revolution;
Chemistry of Common Life; Hungary and


kossuth:


Glenwood or the Parish Bow; Vicar osWake-


field,


Adventures Of Gilbert Goahead:
The Courtesies of Welded Life:
Lilly Novel; The Rase for Riches;
The Mormons at Home;
Poems by Amelia; Onr Countrymen:
Tales from Shakespeare; Elm Free Tales;
Temperance Gift; Lady of the Lake;
I.alla Rookk; Rachael Grey;
Hiawatha by Longfellow; Border Beagles:
Balloon Travels IN Europe;
Italian Sights and Papal Principles;
Court %iip aud Marriage; Lucy Boston;
The Pearl of Pearl River; The Mignonette:
Atlantic Souvenir Religion and Geology:
The American Lady's Cook Book;
Lamartines History of Turkey.
History of Palestine: RomanisIn at Home.
Memoir Of Mary Lyon, Miss Goulds Poems;
Memoirs of Hungarian Lady;
Barnes Notes; MorrIss Sermons:
The Philadelphia Housewife;
The Winter Lodge; Rose of Sharon.
Life of ChTysostonl; Sweet Home;
Good time Coaning; The Casket;
Grimes Household: Stones Edith Hale.
COurtship and Marriage; The Hidden Path.
Married not Mated; Arabian Nights:
Green Mount ain Girls; Ernest Linwood.
The Wide Wide World; What Not;
Liberty and Slavery; Cone Cut Corners.
Memories of Susan Allibone;
Washington and his Generals;
Napoleon and his Marshals;
The Moral and Intellectual Diversity of Races.
European Life and Manners by Colman;
Life and Correspondence of Lord Jeffreys:
Stanhefes Burleigh;
Ny Co1rtshiP and its Consequence by wikoff
Out Of Debt out of Danger;
Patient Waiting 10 loss;
AIS Eot Cold that Glitters;
The Wonders of Science; Bibles; Albums.
Book of a Thousand Songs DC, DC.
ogether with general assortment of school
blank books and Stationery


WARD d SOUTHMAYD.
me 81, 1886."
21_1857-01-01_p1_sn86058106_00279557153_1857010101_0003,Oroville daily Butte record.,01,1857-01-01,p1,"LEGAL NOTICES.

SUMMONS",,"STATE or CALIFORNIA
Comfy Of Butte.


Ninth Judicial Cfs'rri Court December TeriH-De-


eemter 2-d, lSs


VIA. Ila~sy uud c. II. Simpkms,l
Thomas l. Edwards.
HTGs ORDERED By THE CoURr--That thcs
II mons Tor the defendant herein, be published ia
tie bnllr Rccori newspaper published ia Quito
county once a week tor thH -iucr of thirty days.
Attest; th. foregoing irac copy ""f the oFIgunI
orttr tor publication ur ~iuuunu> in tho above tuN'
lied ctHi--, now ut record. ,n ~, Office.


Witness my hand and the s'd ""f sail i'>'rct


Court affixed, this the twenty fourth day ut
us Duccmber. ID 1856, at OroVilie.


NILES CHAPLIN,


District Clerk,
by NJ. II. DARRAcH, Deputy


STATE OF cALIFoRNiA' P,iriGi G.,, c0nrt nTt;,,.
WHl. IIawley and {. H. smpSins Plaintiffs,


Thomas |. Edwards )Defendant.
The people Of tbe Suite of California


To Thomas L.. Edwards GREETING;
N7OU ARE HEREBY COMMANDED to appear
N and answer in said Court, the complaint OF said
plaintiffs file in my otiite against you, within ten
days aflef The service Of his writ upon you. II served
in Butte county, within twenty days If served in any
other county OF this NInih Judical District. and with
in forty days If served ON OF this Ninth judicial Dis""
trct, default herein Will be- entered against you.
This acon is brought against you obt1n judgment
for two hundred and seventeen eighty hundredths
dollars and interest thereon from the Sh day OF jan
uary le5d due on note given by you TO j. nenella
or order November 9Th. 1855: ard for the SUN OF
nine hundred and twenty-five seventytour one hum
dredths dollars due account for Goods. Wares, anu
,lerchandse purchased by you Of plaintiffs, between
October 27ih 1853 and November !ith 1883. aud for
foreclosure of mortgage the American Hotel, and
lot on which the same is located, In Lynchburgh,
Butte county, given by You To secure The payment OF
said sums And plaintiffs notify YOU that il you fail
10 answer their complaint rs herein commanded,
they will take Judgment against You by default for
said sum of two hundred and seventeen eighty one
hundredths dollars aud interest, and five hundred
and twenty-five seveny.fonr one.hundredths dollars,
and interest thereon trOm the day Of judgment ID.
lsj6, until paid, and for costs of this suit Hereof
fail not nt your peril


Witness my hand aud Seal Of said District


Court at Orove,. this the 18th day OF Decem-
Il. ~ ber. \ ID l-j6 MILES CIIAPlN,
ry NJ. ~. DARRAcH, Deputy district Clerk.
d26Std"
3_1857-06-02_p2_sn82006534_00415661083_1857060201_0171,The Washington union.,01,1857-06-02,p2,THE FUGITIVE SLAVE CASE IN OHIO.,,"Brief mention has already been made in our tele-
graphic column in relation to what appears to be a
serious conflict in Ohio between State and federal
authority growing out of an attempt of the deputy
United States marshal and his assistants to arrest
certain parties in that State who stand charged as is
alleged, with harboring and conceaing fugitive
slave In the Cincinnati Gazette (black republican,
of last Fridays issue we find the following account
of the arrests and the rescue:


""There has been great excitement during the last two
days in Green county Ohio in consequence of the arrest
of four individuals charged with aiding slave to escape.
On Tuesday United States Deputy Marshal Churchill
companicd by eleven assistants left this city for Mechan
icsburg Champaign county, Ohio eleven miles from Ur
bana having with him warrant issued by Commissioner
Ncwhal for the arrest of Charles and Edward Taylor,
brothers. Russell Hyde, and Hiram Guttridge, who
the warrant did, about the 2lst day of August 1856,
harbcr and conceal Add White, person owing
vice and labor to Daniel G. White of Flemingsburg,
Kentucky who had previous to said date, escaped into
the State of Ohio and then fugitive from such
and labor to prevent the discovery and arrest
Of the said Add White. The offence charged, it will be
observed is not that the slave aided in his escape
his master in Kentucky by the four accused persons
but that they sheltered and protected him in Ohio Or
in other words, they put him through on the under
ground railroad The penalty for the offence is fine of
a thousand dollars and imprisonment.


son Wednesday morning the deputy marshal left Ur
bana with his posse in hired carriages and in Mochan
csburg and the neghborhood succeeded in arestng the
four accused individuals While the arrests in
progress the most intense excitement created in the
vicinity The news spread rapidly, and determination
expressed to every the law provides to
the prisoners from the hands of the border ruans
the officers called whose sole object it was con-
dently though enormously asserted to take them
over to Kentucky and lynch them.


""a writ of habeas corpus procured from judge in
Champaign county, and the sheriff attempted to serve it
but before he could do So the officers had conducted the
prisoners beyond the bounds of the county second
warrant then procured in Clarke county The sheriff
this instance pursued and up with the party but
they refused to obey the writ The sheriff not having
force compel obedience they proceeded their jour
ney to this city. A third writ was then obtained in
Greene county, and the sheriff of that county with his
posse served it upon the United States officers at six
o'clock Yesterday morning in Jamestown The United
States officers resented the act of the county officers in
seizing their horses eins before making known their bu
siness. warm alteration ensued The sheriff and his


men assisted by excited crowd of two three
hundred persons Rifles and pistols displayed. The
marshal and his drew their weapons and several
shots fired Mr.. Churchill discharged his revolver
at the crowd but injured. The conflict was
sharp and stubborn but superior numbers prevailed and
the deputy marshal with all his posse made prs
oners and despatch received yesterday afternoon stated
that they to be sent last night to Springfield for
trial""


The Cincinnati Enquirer of Saturday morning thus
notices the arrest and Imprisonment of the
deputy United States marshas


All the reports to the main facts of the
great outrage recently committed at Nena in the forcble
resistance of the deputies of the United States marshal
while engaged in executing writ issued ly the United
States commissioner and their arrest and detention by
sheriff of one of the counties aided by lawless mob
There is no doubt difficulty the authority of the
marshaIs the fact of their having the prisoners in
todv and the legality of the officer from whom the writ
issued The naked questions then presented whether
the United States government has the power to enforce
the process of its courts within the State of Ohio whether
the popuace or State authorities upon their private
convictions ideas to the right and justice of the laws
of Congress aside and disregard the authority of the
federal Judiciary and whether the general government
WILL under any circumstances, and from apprehension
of any consequences submit violation
of its power and dignity The test case has arisen


The deputies the United States marshal in the
custody of the sheriff of Greene county. They must be
rescued and released all hazards, henceorth the fed
era government is without weight respect within this
State IL is quite vain to incur the expense of federal
Judiciary here If It is be thus made the sport of mob,
the scorn of the populace.


Some further particulars win be found. in the sub
Joined telegraphic dispatches


""CIScrSSArr May 29-Ihe United States marshal tel
egraphed the Secretary of the Interior to-day for in
srctions regarding the arrest and imprisonment of Uni
ted States officers Springfield but the nature OF the IN
structions received has not transpired.


Judge Leavitt of the United States district court, is
sued writ of haas corpus to-day and the United States
marshal has gone TO Springfield to it. In case OF
resistance being offered IL reported the United States
troops will be called out.


""CISorNS.n May 30.-The United States Deputy
Marshal Churchill and his assistants brought before
Justice Christie at Springfield, this morning.


Messs Elliott and Churchill were arraigned ON two"
4_1857-05-09_p3_sn82006534_00415661083_1857050902_0096,The Washington union.,02,1857-05-09,p3,,,"RESULT REcEsr RAINS IN VIRGINIA. The Lynch
burg yrginian says:


We understand the Virginia and Tennessee Railroad
Company tsays the Lynchburg virgnian) have been
rousy annoyed by land slides their track, which have
interrupted at two points the progress of their From
Big Spring Christiansbug distance of about thirteen
miles, they compelled to carry passengers by stage
At Pea Creek connexion is also broken but the bar
rer Ii not extensive passengers only subjected to the
trifing inconvenience OF changing We assured
that all will be in order within day two, the
pany have set to work with accustomed energy to re-
move the obstructons.


We also learn that tho canal has suffered seriously
from the eshet hut will not be able ascertain its
extent until further abatement of the river The wall
which in of erection at the basin, built
wsbasye by Messrs. Mcdaniel, Hurt y Preston for the
james River and IA Canal Company. and supposed
to be impregnabc has been thrown down 70 the extent
of about 200 feet The wall III rear Of the Virginia and
Tennessee depot running parallel with the river and
tanning the embankmen gave way for the distance of
about 100 feet Immediately below the toll bridge Men
already engaged in making the necessary repairs


The Southside trains still cut off from the
city, and passengers landed at Moriss field about
four miles below the CITY,"
28_1857-07-15_p2_sn86058106_00279557141_1857071501_0050,Oroville daily Butte record.,01,1857-07-15,p2,"Communicated.

Edward LLOYD.",,"and tending to prejudice the community unreasona'
bly, against Loid That il was most unfortunate
affair no one doubts but that il was done upon Inc
excitement of the occasion, without malice afore-
thought the testimony can scarcely fail TO convince
every unprejudiced mind. The testimony upon the
Habeas Corpus examination before Judge Lewis is
very clear and the following abstract taken down al
the time, in justice to all parties ougAt to he pub
lshed 1t is all the reply wAch The friends OF Loyd
ask to be given TO the unjust article aforesaid against
him in the North Califoruian


DR.. McGuhe showed that the deceased tGes
Thornton) came to his death the 5lli day OF july
last from gun pistol shot wound The pan enter
ing on the right side and passing through the ooiy


Mr. I.athrop was at the Bank Exchange IN TINS
place. the night of the 4th. and saw the dilcuy
between Lloyd and Thornton there about ~ o'clock
at night. Saw LoVd come and sit down near morn
iou, who was sitting by The table where witness was
Lloyd and deceased conversed together-'had good
many wOrs--they arose 10 their feet at the same
time. witness also sprnging To his feet at that mo.
ment. Witness heard the tumher strike and heHrd
the report of the pistol Immediately u,er. Presently
saw another iumbler thrown b. The deceased TO-
ward Lloyd. The motion 10 draw the pistol Il sup
posed) was mpde before The tumbler WAS thrown. |
saw but two shots fred--heard the third one. | did
not pay particular attention To The conversation be
tween Lloyd and Thornton. Heard LLOYD say To
Thornton that he had beaten him once and he VoYdl



Thornton TO stand up to fight. Heard The words
''liar' used by and coward"" by the ether. Saw
thornton slip his hand along the table for ihc crib
bage board before rising aud he seized two um5lers
and rose with them one in each hand. THIS occurred
in the Bank Exchange in Butte county.


Cross s-Examined-T was sitting at obiong
square table--deceased was sitting near the same
table IN a chair. The first saw of Loyed was when
he came and sat down by my side. Loyd's remarks
were mild when he commenced Enthusiastically
So ! could moi say which nrose first; myself, Lloyd
and Thornton arose simultaneously. Heard Lloyd -
he arose call something or speak to some person.
think the pistol was drawn as he was rising kept my
eye upon him. LD'd said ""you call me ""A d-d son
of bitch"" and sprang back from the table The
tumblers were thrown in quick succession saw two
of them thrown. Deceased was not sho; 10y the first
bali; that fred into the ceiling DO not think saw
the first tumbler thrown,


BY tie Court--The tumbcr was thrown frst-aiter
the first pistol fred another tumbler was thrown


Mr. ,res.-l saw the difficulty. | called Lloyd.
who was standing by the counter with another man,
he came and sat down on my left near ThoruJou.-
Spoke TO Lloyd apoW II former d,ffcuuy he had tbat
day. In the conversation with me, LoNd turned and
said "".nere is The only man that ever whipped me-
pentffg 10 Thornton, and asked Thornton II il was
not 50. Thornton replied that he believed il vas
Lloyd then said, 81 have grudEe against you. lhorn-
ton, ever since. for yuu took me1E adNdtallNge Of
me, when Was sick from chill. and fever"" aud he
asked Thornton il be thought he cUuid whip him
now; said that he wCuld like tO have Thornton come
out and have a 'air stand up fight Ihufat0n replied
he was not on the fight then. that Il anybody would
strike him he would fght. Lloyd replied. Eyes you
are like all cuwaris. they want 10 be struck frs""
and asked him II he would stand Up thornton said
""you needn't wait for me 10 GET rcady-pHch in--I
am always ready"" and he men slipped his hand
along the table stealthy and got lao of the crbhaGe
board and partly raised up Lloyd said, ''dOht throw
the tumbler, You son of a btch.N Thornton rose
with tumblers IN his hard, and threw AT Lloyd, who
rose at the same time; the tHmber struck LoYed on
the breast before the pistol was fired; the Gmbler
did not break til II struck the ground.


Cross Examined u do not know long Loyd had
been in the room before called him; he did no.
come TO the table till called HIM twice. COM
menced the conversation first myself ii was not
particularly in good natqred manuer, nor by any
means In an ugly manner Think Lloyd arose H little
first; directly when he got on his iee he sad ""dVu
throw thai tumblcr you son of ""a bitch"" was about
Tia rec feet from Thornton aud about five feet irJm
lloyd when the first tumbcr was thrown. Did noL
see the pistol drawn AZ that time. do not tnini it
was drawn.


BY the Courtroom the character Of the convcrsa.
ton did YOU think he wai ted 10 fight any other way
than with the fist? did not think Other wise


Mr. Hmmel -Between and 10 o'coch on the
night OF the 4h was sitting at n table in Bank EX
change with Mr. Lahrop: deceased was sitting there.
Lloyd came and sat between Mr Lathrop and de-
ceased. When they convcrscd thought they were
in n joke. Lloyd said, YOU whipped me one--l was
sick then-can you whip Ine now? Deceased re-
marked he was not on Il fight. Defendant said ""you
are cowardiy son OF bllch."" At that both arose;





they arose; thornton when he arose pat hrs hand
against defendant ana pushed him back. Thornton
then thre w the glass, eXcianing. you ID Irish son
Of biich."" When The glass strucN the defendant the
pistol went Off and went nearer Lathrop than Thorn
ton the bail lodged in the window frame The pistol
was not drawn when the first ttumblef was thrown.


Cross Examined.-l was nearer Thornton than La
throp was. When defendant put his hand across
himself he was standing; ke end deceased were
facing when they arose, their heads within loot
of each other. Deceased had the criGbage board ia
his hand just before he arose; was using 1t and no.
ticed 1ornton take hold OF it, think he lhreW it when
he was standing up.


Witnesses examined by defense;


MIR. Lynch.--Was tending bar nj the Bank TX
change when the difficulty occurred WAS standing
behind the counter when Thornton throw the tumber
which struck Lloyd on the face Thornton throw
three glasses, two before the first shot fred; he
had two tumblers in his hands when he arose; after
the second tumhler was thrown the pistol fred ; tie
second tnmble- struck Logged the left hand, he
threw up his hand toward his breast 10 ward of the
blew. Here the defendant held up bis left hand al
the request OF the Court, where there Is deep
wound on the back near the left side evidently cut
by the second tumberl J saw distinctly the defend, q,
ant when he drew the pistol: il af,er the second
tumbler struck him. He then drew and the pistol
went of at random into The ceiling Deceas ri ihen
lhrew another umbler near The pillar.


Ihos. ford.-Saw the difficulty: saw two tumblers
throwh % Thornton strike Lloyd, then be Grew the
pistol One OF the tumblers struck Lloyd on tho back
OF the hand, as he trying to ward II the m hlers


Mr. Murray Saw The diiculty-saw two or three
tumblers thrown; could not say how many bui i, was
two or three, before the pistol fred.


MT Doud.-Saw the dIficaty-saW something
supposed 1t 20 be a tumblrr, hit Lloyd on the hand
before The pistol was drawn.


Mr. Malef.--Whs bar Keeper at the Bank Ex.
change when the difficulty occurred. Saw Thornton
throw three iamolers stood behind the counter at
lhslt N ILaH frs. lt,,"
50_1857-10-31_p3_sn82014998_00279557967_1857103101_0179,The Placer herald.,01,1857-10-31,p3,,,"The Dead Sea is so named from no Av-
ing object being found alive !"" Il. The nor
thern bottom is almost fiat; the greatest
depth is l,l2s feet; near the shore the
bottom is generally saline ipcrnstat'op;
intermediate are mud and pure salt. It's
shores are covered With iucrusations Of salt,
and footm arks in an hours time become
covered with crystaizatiops, Captain Lynch
feels confident that the result Of bis ex'
petition confirms to the very letter the
History of the Holy Land. as regards the
surker cities."
