article_id,newspaper_name,edition,date,page,headline,byline,article
3_1850-09-21_p3_sn82014892_00393342870_1850092101_0079,Southern shield.,01,1850-09-21,p3,S835 G& WARD.,,"STOLEN, from the subscriber, on the night NS of the llth inst, at Fernando, De Soto county, Miss, large bay orse, about years old, both hind feet white; good saddle and work horse. This horse was stolen by @ man who called his name Wm. Lynch, of inc fol- lowing cription:-About six feet high, 22 years of age, weighs about l6O l5s light hair large dull grey eyes; bas had his right arm bro ken, which is somewhat stiff. He also took an uncovered Spanish Saddle, and fine double reined bridle, with curb chain.

 He crossed the Mississippi river at Helena or Delta, think, and is no doubt somewhere in Arkansas.

 l will give reward of $35 for the delivery of the horse and thief to me at Hernando, or $lO for any information that may lead to the recovery of the horse alone; and S25 for the detection of the thief if lodged in any Jail.

 A. s. BAILEY. Aupust 24th, 1850."
17_1850-03-14_p4_sn83030313_00271743014_1850031401_0341,The New York herald.,01,1850-03-14,p4,,,"NOT 'nsrFfed tless duly duhe'lfsested and pod Io


Married,


On wednesday evening, March 18th, by the Rev
Mason Noble Mr.. GEoReE SrourESBcReH, to Mrs.
CHARLOTTE PrERsoN, all Of this city [Ss Louis and
Poughkeepsie papers please copy


In Wihamsburgh, on the 18th Inst, by the Rev Mr.
Porter Mr. ALBERT JocEIrN, Of that place, to Miss
MARY SALISBURY, Of Cincinnati.


In the city OF Paris, (France) ON the I'd February
1850 Mr.. Anne LEGoUx merchant formerly resident Of
this city, to Miss FfLIcrE PLrsss, both Of Paris.
On the 18th Of February, at Gusyama Porto Rico Mr.
RoBEKr McFHERsoN to JULA, daughter Of the late Mr.
Fran els q Lynch, Of this city."
3_1850-03-02_p1_sn82014892_00393342870_1850030201_0035,Southern shield.,01,1850-03-02,p1,,,"appardon of armed men on the bank. He knew at glance what 1t meant. The mob, to prevent any of the Mormons from escaping, had stationed guard beyond the river. He instant ly turned his course down the stream, when whole platoon let off their rifles, bat the dis tance was too considerable A hail of bullets rattled around him on the ice without ury.

 Il will foil the iends yet"" he said to himself and put forth all his speed. Mills flew away, when he became conscious that some one was pursuing him. He stacked his velocity, and gradually wheeled about to take view of his enemy. But the latter was still ta remote for an accurate surgey, and t!te hToeilafs s...ssza-. aloud mad prayer-''God grant me that 1t be Col. Turk, and I am willing to die!''

 On rushed the pursuer--ou, still on, like an avalanche. The noise of his iron skates could De heard above the roar of the northern blast, and his dark form loomed in the glitterng moon- beams, large in statute as a giant. As he drew nearer the young preacher smiled venomously. He recognized the arch persecutor, Col Turk, and he laughed outright laugh, that rung over the frozen river like tie wild scoh of some demon, when he saw the other unshcath his gIcaming knife. Mills then immediately pulled his own from its scabbard, and started off, so as to avoid the coming shock, which might other- wise prove fatal, by the mere force of the colIis- ion to both.

 And then began a series of rapid and cunning evolutions to secure the advantage in this new method of combat, the most terrible ever cone ceived. They marked the smooth surface of the ice with circles angles, squares, paralIeTo- grams, and almost every possible figure of plain geometry; but each seemed perfect skater, and could not find the other at fault, or take him un- prepared. They passed repeatedly within three feet of each other, and made quick thruss which pierced to the bone! And still the cloud grew more intense, and the Wrathful wind howled on, while their man9uvres and flights somehow carried them farther down the river where the crused ice was thinner and cracked fearfully beneath their tread.

 Finally the Mormon took the desperate re- solve to terminate the strife by sacrificing his own life so as to make sure of that of his foe at the same time: In the following rush, he no longer turned aside to avoid direct collision, and frustrated the attempt of the lyncher to that end by swerying slightly inward from right line.

 They met at full speed, and the shock was | like that of the crust of adverse comets. At the moment of their fall the quaking ice split beneath their weight, with dealening roar and | the wild waters, boiling and hissing like hell, | swallowed them lOreVer--the persecutor and his victim, both victims now!

 But the river still rolled on it way to the sea: the stars all shone as bright and beautiful as of old in the morning of creation, when the angels Of God chanted their birth song; and the wrath fal wind of winter howled on over the icy grave of the enemies nO m0re!--Sa0aduy ItnIeS."
17_1850-03-02_p1_sn82014892_00393342870_1850030201_0035,Southern shield.,01,1850-03-02,p1,"John Mills. the Mormon.

HIS FIGHT WITH COLONEL, TURK",,"

 10 be present.

 A strong violent mob of Iynchers was about this time organized to put down the MIormons, under the command of Colonel Turk-one off the most desperately dangerous men that Missou- II, or Ill truth, any other country ever produced. Some Of the Mormons were tared and feathered. some were scourged with long, knotty hickores, till they tainted from the excess of torture and the loss of blood-others were forcibly deprived Of their property, and reduced in day to the condition of beggars-while others still shared a doom of more mercy and were shot down on the prairie like So many wolves. At last Turk resolved 10 take some of the concet out of the young preacher, Mills, and he gave notice to his men accordingly.

 It was dreadful cold night in md-winter, l833 and although the sky was cloudIess, and the full moon shone out in all her splendor, the earth lay in that pearly radiance, chill and dreary as frozen tomb; for thick sheet of snow crusted its surface, and the north wlnd howIed over 1t dismal dirge It was night to drive even the thieves and outlaws into barns and stables for shelter, and to keep honest people by the blaze of their own roaring hearths.

 And yet strange to say, in log cabin, within three hundred yards of the Missouri river, then

 

 people had assembled to hold religious meeting. They were Mormons, you may be sure. No fanatic of an old faith would have turned out on such night; they must be fresh zealots, with some new idea but at its birth in their hearts and flaming like meteor in their imaginations, or they never could have ventured to face such an ice blast as that. The congregation included men and women In about equal numbers, and many of the former carried rifles, which they grasped with one hand, even when kneeling down n prayer; such was the immincnce of peril either real or imagined as they deemed pending over them.

 The preacher--the enthusiastic Mills-I1ad advanced to a thrilling head of his eloquent dis course, and was painting in terrible fire language the bitter persecution which has ever followed the footsteps of all great relormers since the ] beginning of time. Never before had he been half so animated or half so affecting. His blue eye gleamed like a star-his voice pealed like a trumpet, shrill as the wild wind which whstled over the house top; and his beardless lip seemed literally loaded with music. Groans, tears, and wild shrieks from the audience, proved the despotic power of the utterance. Suddenly three rifles exploded in quick succession before the door, and three sentirels, shaking with ter TOT, rushed into the room, crying out--""Ihe mob! the mob! Save yourselves from Colonel Turks mob''

 No person can depict the scene of dismay and confusion that ensued. The females screamed aloud as if all hope had departed. Several of the men sprang out of the windows and fled, as if pursued by a legion of devils, while most of those who remained appeared supplied and to- tally poWerless, either to escape or make ready for resistance. Indeed there was little space allowed for preparation. In few moments mob amounting to hundreds had surrounded the building, and the muzzles of fifty cooked guns and pistols were thrust in through the doors and windows. Still none within lifted finger for defence-fear seemed to have turned them into stone. Persecution had not yet hardened the ""Latter Day Saints' into veterans, and the after wards famous ""Mormon Legion"" existed then only in the imagination of the prophet.

 Presently the lynchers, headed by the all- dreaded and gigantic Colonel Turk, rushed in, and began to beat the people furously with the iron ranrods of their riAes with very little dis tinction of mercy as to the age or sex. The cries and vain enreaties of the poor sufferers sweled to vail wilder than the bowling of the wind without. At length Col. Turk roared- ""Turn out the women and seize the men, and let us have the hickory switches and the tar and feathers!'

 And the drunken mob shouted, and hastened to execute the brutal mandate.

 Up to this time young Mills had continued standing with the Bible of their prophet in his hand, but unearthly pale and strangely excited, his lip writhing, his teeth clenched, and his bright eyes swimming in a halo of fire. Sud- denly he made bound for an adjacent window, and notwithstanding more than twenty endea- vored to seize he, he effected his escape from the house.

 ""Chase him--shoot him--take him. alive or deadr'-cried Turk, in a transport of rage, set ting the example by commencing the pursuit himself.

 The flight of Mills was directed in a straight line for the river, and his marvellous agility, him at some distance ahead. They fired both rifles and shot-guns at him as he ran, and happi- ly without effect. When he came to the river side he stopped down, and hastily fastened on pair of skates, which he had carried in his pocket for the last few days to be ready for any extraordinary emergency, and then taking the ice, skinned over the frozen stream with the swftness of the wind.

 ""Has nobody pair of skates?"" shouted Col. Turk, striking his forehead with gesture of wrath and vexation.

 q have,"" answered one of the mob; s'but shall certainly not try them on the ice such a night as this.'

 Be quick, give them to mer' exclaimed Turk in a tone of fiery impatience

 The skates were produced; the eager Colonel tried them on, and then, swearing a dreadful oath that he would bring back the preachers scalp,or leave his own, he began the perilous chase. Oh! there is no darking like the courage inspired by the passion for revenge!

 In the meanwhile, Mills had approached thel"
9_1850-06-04_p3_sn83030313_00271743014_1850060401_0726,The New York herald.,01,1850-06-04,p3,"rLOnrCULrUs,E..-",,"ELoRIcuITcRr -RUssrLLs NEw coLLE- -rrov or
~ hmertean 'eiarorniums Cor seraniunal arr nov in
wsr va Nietoria Queen q the West W. ~ Vi II


. Orgeud Fanny kemble Jenny T. rd Silica Tree fr,nt
Ber~r Anna Lynch, le1ry Clay As.lrta. ~ Rss..
tarusncits Asos's sc Alec ooeett- n rieh AID
ttau fni rareFated hardy htAas co.taEe rofea -hn.
crors tc bauqusts tastefnlly made tfessa evrs
from The Ianr a. the sar1en, heary street AanNs
street, south Ferry Broosiyn."
29_1850-10-05_p2_sn82014764_00415661472_1850100501_0388,The southern press.,01,1850-10-05,p2,,,"= r nnunnnhf6x ~Aus
vedly inflicted. The spirit of hostility thus cx-
hibiIed, increased and heightened as it will be
by corresponding retsliatory acts from the North,
cannot be suddenly or violently alIayed, but on
the contrary these acts will but serve us fuel to
inpart intensity and vigor to The fame. 1t is a
trIte saying that none can hate like brothers
The future historian may find in the issue of the
present controversy another demonstration Of
the truth of the aphorsm.


From the .9i5any (Geo) Patriot.


The SOUTHERN CosvENrIos-The Charles
ton Mercury Invites the attention of the press TO
the subject OF the proper place for holding the
adjourned Southern Convention, and asks a
general expression OF opinion, us 10 whether it
should be held IN Nashville or in MilledyeyilIe.


We have no hesitaney in Recommending that
the Convention should re-as sembIe i'm Nash lie.
lst. Because the Convention itself made no ar
raugement suggestion for another place of
meeting. I'd Because there is no good reason
for the change. And Sd. Because it will be


looked upon, if held in Milledgeville, as nm at
tempt to influence the Georgia Convention, which
will be in session at MledgeyilIe about the
time appointed for the meeting of the Southern
Convention.


The whole power of the Southern Convention
will consist in the force of its reasonngs and
the wisdom Of its recommendations, and in our
opinion, nothing should be done which wonld
tend to cast suspicion upon the motives of its
members.


DIsUNfoS.--We learn that n gentleman, (8lr
d. ). Walker,) now traversiDg the State as can
didate for office, is circulating the report that
Judge Broome and Maj. Beard are disunionists
and that the former SO expressed himself in a
speech last Saturday at Miccasuke. In regard
to Judge Broome, the Sentinel in its report of
his speech says:


:"" He defended his position with good deal
of ingenuity and eloquencc--declaring that he
was better Union man than Cor CaN""


All this of course sIr. Walker hard and now
full well remembers.


Maj. Beard says in his circular


:"" Fellow citizens, we all cherish a habtua
aud hereditary love for the Union: but it i, the
Union that our sres bled for--an Union of eoa,aL
rghts-an Union to promote the general welfare
hot that of Il particular section an Union to
secure domestic tranquility and not one to
expose us 10 The horrors Of serrite (negro) ,ear,
ercited by those cho ought 10 be our friends
. | love the Union with reasonable affection.
not with a servile or superstitious reverence. as
some great invisible deity. l love it for the
benefit 1t HAS bestowed ON us, AND SHALL cos
TINUE TO LOVE IT TILL IT CEASES TO BEsTOW
BLESSINGS, AND BECOMES THE DESTROYER OF OUR
| PEACE AND SAFETY""


Comment is unnecessary We have only TO
request our readers in any neighborhood which
Mr. Walker passes to use this extract from the
| Senmeh and these sentences from Mai. Boards
address, to correct any false impressions which
he may nale.--Floridian.


From the Lynehburg (pa.) Republican.
|


TO think that this paper and the Richmond Exam
iner are the only journals in the State which main
tain their uncompromislng opposition to the od-
GUS measures OF Congressional robbery recently
passed into laws but never were they more mis-
taken Those who have PLAYED traitors to the
South in The contest, are crying peace peace not
not because there is peace, but because they want
peace that the awful consequences of their conduct
may not be visited upon them. 1t is natural for
men who bring about results dsgraceful in them
selves to want to hush it up, and not be made the
subject Of fanimadversion.


The Portsmouth Pilot, the Norfolk Southern
Argus, the Fredericksburg Recorder and Freder-
icksburg News, the Spirit of Jefferson the Abine-
don Democrat, the Wy,heyiie Republican and
other papers in the State still breathe the true
Southern spirit. These papers combine as much
| or more talent than any similar portion ofthe press
ofthe State. The Fredericksburg News is whig
paper, and we are sorry to say, the only one in
Virginia that has not played truant to our North
ern lords and masters


As to our course, pleased to meet with
the most gratifying evidence OF its being warmy
| approved and commended in this section by the
democratic party, with but two or three honorable
exceptions, and many intelligent and influential
| Wings. One OF the staunchest and most respect
abeWhigs in Lynchburg called at our Office few
days since, and requested TO send him the Re
| ipublcan-that articles unon the Southern
question pleased him well he was obliged to take
the paper, Notwithstanding our democracy"" To
/ IlS q his nrUS A ffn t,t,z
street the same day, and insisted upon paving us
another years subscription, although his account
was then, more than balanced, giving as a reason
his "" arm approval of our course. We, of course,
could not refuse to receive it! While we are i'm
constant receipt of such evidences of public appro
val of our course, several of those papers which
have espoused the cause Of Mr.. Clay's "" Omnibus
have been steadily losing ground, and receiving
letters upon letters of rebuke and denunciation
while from every quarter, and from those who do
not suspend their patronage, curses loud and deep
are constantly to be heard.


But whether our humble course had been an
proved or dIsapproved, we could have pursued
none other with our convictions of seIf-resp
and OF pubc duty We have proposed no rash
measures, nor do we intend to propose any, We
have not advocated dissolution of the Union. nor
do we intend to advocate it under present circum-
stances. But we are of those who believe that the
Constitution of the country has suffered gross
intractlon IN the passage of certain measures that
!
rngly violated and trampled upon their constilu-
tiona and social equality destroyed, and the lib
erty and property ofthemselves and their children
! imperilled! Entertaining these views, and SOL
emnly impressed with their importance and bear
! ing, We should feel recreant to duty, did we
not endeavor 10 impress them upon the minds OF
the people, and the truths connected with them.
Our representatives IN Congress, who have stood
by the South m this contest, threatened will,
political demolition because of their course
Where they cannot be beaten by Uh;g candidates,
the submisslonsts intend running Democratic can
dldates, and III that way hope to crush them.
Under these circumstances could do less than
"" cry aloud and spare not 7"" Could we do less
than keep the people Informed and impressed
with the nature and effects Of measures which are
to enter into the Spring Canvass, aud to be made
the ground OF warfare against our patriotic repre-
senauvess


\ bill to repeal and annul the fugitive slave


law, passed September 1850"
17_1850-07-27_p3_sn87090127_0029587756A_1850072701_0120,The organizer.,01,1850-07-27,p3,OXFORD MALE ACADEMY.,,"IWNHIS Institution will be re-opened on
- Monday l7Ih June, (nst J
The subscriber has the pleasure Ol announc
ing TO the public that he has associated with
him, Mr. NJ. J. LYNCH, a gentleman pre-.
emInenlly qualified 20 teach the


CLASSICS, MATHEMATICS L SCIENCES


Tue Session will CONSIST Of five months.


TERMS.


FIRsT CLAss.-Spelling, Reading, Wr-
ting, Elementary Geography and Ari'hme.
tic, $40 90
SECOND CLAss.-Practical Arth-
metc. Engpish Grammar, and Ge-
ography, continued, Sl2 90
Third Class Natural and Nor
al PHI osoPhy, History, Rhetoric
and Chemistry, els 90
FOURTH CLAss-Embracing Col
legeaIe Observation-Disclosures,
Moral Philosophy and Chew,stry,
including the Latin and Greek
Languages, $50 90
01-French taught if required for which
an extra charge is made.


Board can be had in the most respectable
lamiiIes Cor S. per mouth.


JNO. w. RISON,


June Is, 1s5O.-16-n0-l. lPrineipal"
