article_id,newspaper_name,edition,date,page,headline,byline,article
3_1847-03-24_p1_sn82007022_00393342894_1847032401_0083,The Arkansas banner.,01,1847-03-24,p1,"Fron the WashingtOn Uaion.

 THE PRESS.",,"We were saiisfed si.ai the coalition iu the Senate were striking . blow at us, which would infallibly recol upon themselves. T we had selected the vantage ground which we were to occupy, we couid not have chosen a stronger position than the one upou which they have placed ss. The honor of our country in the nids. of foreign war, and the liberty of the press Js

 ""Three is he armed, who hath his quarrel last. 2

 We were axare of the excitement which the p members of the Senate would pro- duce by their sentence ef expulsion. We knew that they could not reach us-- they could not degrade us-bu, that the peoplt would stand by US. Bu. really, though we saw 's,hey were sowing the wind to reap the whirldwin,n ? vet even ws had not faseseen the violence of ihis excitement The aemocsal- ic aud the neural, and . small portion of the whig press, is rnsling to the rescue, and doing its duty. The people are holding meetings to support the war, and deuoance shis attack upon the liberty ef tisc press. We have foFbofne iEoGbling our senders witi, many of our ewn reflections, and eontensad ourselves wiih laying before them the ..Spiri, of the free press."" But alnsost every demo. cratic Psess is speaking aloud, and thS mass of extracts which we haze made is co rapid- ly accommodating upon eur hands .isai already we could fill several papers with their con tents. The resolutions of popular meetings, too. are beginning to pour in upon us For example, take this evening's southesm usaiI only. We have the proceedings of meetings in Nelson and King William eoonfr,es r,y Lynchbargh and of Norfolk, and of Athens, ia Georgia. The Democredc papers 6l 0sesgia, and Of New orlesss. by ssis mall, are speaking os. in the most indignant strains The articles breathe he simost defiance against the act of the Senate and its authors --ss well as the most eloquent sssertion O the rights of the press. The cosnplinsfst, to ourselves are pressased ia various phrsse and fil us with the deepest gratitude.

 Tae Milledgesille (Georgis1 @Federa Union,s .. the close of Ioag and beau.ifu ariice. says truly

 sThs mirror thai the Union hes thus pre-

 seated, reflecsing the true iealares cf the CD i posiiipn, has become edious not only |. them, but also io those democrats by pro fession. who, intent upon their o~ ~n schemes are willing Tor their own elesslion to odessro1 the integrity ef their party. They has

 aimed thsir kie~; hat the;s xiesim has na fallen- He stands erect in the eonsciossnss

 q innocence, mcre fully dessrmjaed thsi"
