article_id,newspaper_name,edition,date,page,headline,byline,article
11_1850-04-10_p1_sn83030313_00271743014_1850041001_0454,The New York herald.,01,1850-04-10,p1,"Superior Court.
Before Chief Justice Oakla,",,"


Before Chief Justice Oakley


ACTION OR sEDUcTIoN-BESSETr VS.. BAGI.HY.


SrcovD DAY


ApRn p.--Damagcs were laid at $4,000 The court
densely crowded amongst whom were several re-
spcctabe looking females friends of the plaintiff.


Catharne c. Rennetts direct exami nation continued
by Mr. Cook met Mr. Bagley since this suit was
commenced yesterday three weeks; he offered me
$500 and note for 500 TO settle it, he said that he
would settle with but he would not give my fs.her
the sstsfac ton to settle with him; said could not
he said. IL know what you can do, you go tho
stand and Ii took place In house, and not in
the offce;' he wanted me to meet him in the Park
the first rainy morning. TO go to house with him;
said would not. that he could not prove had ever
been in u bad house. and he wanted me to 20 there
that he might have witnesses to prove in one:
he said he afraid he would have to bring witnesses
to clear his character and he could do that with
out bac ckening mine; asked him why he brought the
two men, Van Brunt and Manning TO the Tombs apI
he said he could not afford to go to tho State prison
for two years. he sad in relation to their testimony
that any fool could zee they were not swearng true


Cross-examined by Mr., T. sla~;,en-i am now Nine
teen years Of age; was boz in 1881 on the 25th o
November my age IL i,ut down In the Bible at home
by my fathsri write little; never signed my nam
but opse, and that was not my own name, In Mr


utchns' office: never write letters; father livcC
In England when l WAS born only scventcc r
months old when we came to this country; resided
I'm New Jersey after csme then came to live In
New York, and then went back to Jersey City never
testified that lived In this city seventeen years
said was in this country seventeen years my father
names Of some young men boarder- who are living
with her father:l i was working with Mr.. Ackerman,
book folding In Ann street before to Eagleya.
this two thrcG weeks before went to Baley r.;
There were two men employed there, besides Mr..
Aekcrnau; my father was living in New jersey
when he in Bagley's employment; I four
fve times nj Nr. Bagley's, helping my father,
before commenced my employment there; he was
polishing pencils: II was In hall that he used to work
have been In the other parts OF The house. u here
witness enumerated the names II = number Of men
who worked az Bsgleys)-I went Into that room to
speak to Mr. Bowdcn. who was one Of the workmen,
aud used to board With us l used to speak to him
nbout his wife; ! did not know whether ne was mar
ried or not; did not hear he had left his wife in
England; hr said to me not right for me to
to Bsgley's, where there many men; IL was
then said 10 him II Of his business aud to
mind his own Children "" he bad any he said he didn't
rbink It wsss ptop.r place dseent girl CO. aud
I again said TO him to look to hs owns this eonver-
sstidn before went to work at Bsgleys; heard
In lorkvilr. from acquaintance OF mine that
Bowden had u wife and children In England sup
pose hmy ON more than two occasions spoken to hin,
about his wife and children he L. very partic
friend Of oure; don't remember that ever told my
father that Bowden had wife and children belicv,
my mother wac present ut one time when told him
90 mind HE own | was sixteen years OF aga when
useh TO speak To him In this way he spoke To- ate
] WIS in Bagieys employ, and told him no would
have enough 20 DO 20 To hs wife and children h'
asked me how liked being there. and said very
well; he asked me II any Of the men came into ths
room where ! worked; said Yes, once In a
while !"" and he said thst he thought none of ths
men were to be allowed TO go In IL was not quite
two weeks after I went there that this eonver-
sstion took place IL long room,
psrtitioned hall. In which used b. work when 4
went there frst vas not placed la room ~here
there were great mony men before ws- In Bag
ley's employ. and on the occarlons went into the
room TO where the men working, II was merely
through curiosity ssd to him, you have nice
place hsrey' only went onc. 70 Bowden and on ce
to my brother ;; don't rccollect speaking more
than to pass the time Of the day 20 the spoke
60 Pcsrson, Beach and another used tn carry my
fathers tea to him To- that before engaged
there don't remember my father ever telling me
ought not To 40 Into that room have taken tea 10
my father when he used work in the back sni
while he was taking Il have gone into The Workshop
were my brother sud the other men were st work f;
mir tsu In Ito xllan
l. the zane person that Mr. Bagsy wanted 10
the child TO bsvc taken tea % my father probably
twelve or Gcrtccn tmcs. before I Wa employed at
Bneiey's. and helped him st his work nvc or six
times, aud stayed there about hour and sometimes
more the Whole of the partition up before vent
20 work at bsgi.ya sfeEvasds ZONE q u was tsk n
-own Az sins.. T55m vas Shs.I-s- n' IN thsEs
were two chairs IT, H. long table. carpet and stove
the table wrs about wide tho jurors dsik about
fourteen or htscn nehee 70 about long as tho
judges bench fwitness here described tho lpcslitics
of the rooms. hrn and passage. from diagram pro-
duesd by Mr.. so-sen In the part Of the entry that
was thrown into the big room, two men were put TO
~ork-one named Lynch. the other Goolie there
were four men and twv boys working In the room nd
Joining them knew sIl ufthcse men got seluainte
with them after went 10 the employment there
together.


The judge objected To Thu mlnusnes- ifth~y wauted
TO prove any undue familiarity on the part ~ the
vitness ten men would DO well ~ forty Laughter


""nucss eontinued-I was scquqinted With all these
MN, but never had any familiarity with them have
gon. into those rooms In the morning for pens fr Mr
bsgsy tomsties for the hey of my door, which y
coicred man used TO Keep When did not take u home
Nth mel have gone into the room whore John Bernard
rocm had no business there; l would stop mi
mute 90 two perhsps Eve minutes he f,d one day ~
ne, heard somsthing ofyou Js.terlsy :"" s.ksi
him ~hst u wss. and he said fueu vent u your
room and the door locked "" ssid IL vas not ""a
told Mr. Bsgisy what Was said and he sont for Bnel
hun why he ssid so snd he said il W. I9sSei; Nr
hsRisy sstd IL was not Tho door va lpeked; have
se'n Van brunt sev.rs times In bernards rom; he
never took any hlertcr with wisievsr. nor never
attempted nor did any OF the men orrrqt hr Haglcy


nave never seen Bernard chang"" his 81 lther ne has
taken ~ hs work clothe. and put hi street
clothes before me; have recollection oftesnng ON
the table IN hs room IN an immoiest way have ne
Yer shown him or Van Brunt any pictures except my
dsgusueOtype; have never shown them any freneh
cards or French pictures; I have heard of Frcnoh
cards but never any; have never had any I'M
made the sfhdayit In Mr.. Hutchins' ofiee, that
was marfitd he ssid 10 40 you aro mprriei and


'aid ""l,si' never told Ven Brant was married;
nr ihilips said he ws- very glsd 10 hcsr ws- msr-
risd nnd thanked him; never told shanfros. Man
ning. fitzgerald or ONeil that married. never
had any of Paul de Koeks novels In ny possession nj
Btgleysi used TO 20 10 work ab0u. O'Clock and
fspley uesd To- coma between aud 10. Bernard was
g.h.thly the hr,t nan there; ono day the soorei
man had The Key q my aud did not como. and
vts IN and out ~ the other rooms the r,t time th.t
hr bsTisy treated me shout 10 o'clock IN ths
morning; know u was In the month ~ March. be-
cause had borrowed watch from one of the men TO
50 TO the Csmhfisn hall In the Minerva Rooms vas
the nsst week sfter borrowed the watch. thst what
.ceurrcd between and Mr. negiey took pisee; my
brother vas With AZ the hall. Bsgiry hal
been ut me for long time 20 yield 10 him aud
I y;eldsd that DAY. fThc witness here inter
r,Erted NJ 90 fuhscquent trsnsaefions. but aid
he could not 90 than tsr~c times !
one ~ the msr NJ work in the rom NJ The other
'dc ~ the partition st the time u the hr-t trsassc
ticni made No Noise; vber be commenced sprrking
To me hr't told him he had brter 90 b. Jans
iHg Mrs.. inaic; Hrs. fneie used w. eJne down fre-
gu'ny 10 20. Br Bagley; when she called she ssked
~ me and the conversation had With Bernard sbgut
h'r ~ss he islhng me that u good esens~ f,r
h'r coming 70 sse and thrt she nothing bat
"" when flc used 60 up 20 eee VIZ. bsglcy
r'nerrnr vent out, 4 only vent 10 her hou'e once
tsfcre went To live with her aud that va With
note from hr. bsgiry; while 4 stopping ~ Mrs.
frgles rceollect sent 10 Mr. Itutchins once and
uktd him 10 tsn Mr. Rsciey where hsd gone, but
did net fsy I ran sway bcesuss my ysre,ts had"
38_1850-11-09_p4_sn87090127_0029587756A_1850110901_0135,The organizer.,01,1850-11-09,p4,OXFORD MALE ACADEMY.,,"TRHIS Institution will be re-opened on
\ Monday I7th June, Gnst.)
The subscriber has the pleasure Of announc.
ing TO the public that he has associated with
him, Mr. N. J. LYNCH, a gentleman pre-.
eminenily qualified 20 teach the


CLASSICS MATHEMATICS & SCIENCES
The Session will consist Of FIVE months


TERMS.


FIRsT CLAss.-Spelling, Reading, Wri
ting, Elementary Geography and Arilhme
tic, $40 90
SECOND CLAss.-Practical Arith-
metic. English Grammar, and Ge-
ography, continued, Sl2 90
THIRD CLAss-Naiural and Nor
al Philosophy, History, Rhetoric
and Chemistry, SIS 90
FouRTH CLAss-Embrscing Cul.
lereais isDepsrimeni.-Maihemaiics,
Moral Philosophy and Chemistry,
including the latin and Greek
Languages, $50 90


TFrench taught if required for Nhich
an extra charge n made.


Board can be had in the most respectable
families for 81 per month.


yNO. w. RISON,
June Is, Is5O.-s6-no-l. [Prineipal"
6_1850-06-28_p4_sn83030313_00271743014_1850062801_0841,The New York herald.,01,1850-06-28,p4,"Passengers Arrived.
NoniE-Brig "" sbsega-J N Givit.

",,"Ssr FRAScsco-ship Potomac from New Oreans-Mrs
Shley and servant Mrs Taylor and el lid, Banner
PKuebsnths Knchcnhsi John Steward and wife. Thos
CLARK. lngtman. Bryan Gouley Peltr ovemer Jane,
Baron, Ernst, W Hoffman, Finger. Grandols W He's
Thos Lynch, Martin Grouey usger Basby Sullivan
A Bunder II By er, wife and child."
37_1850-04-04_p4_sn83030313_00271743014_1850040401_0429,The New York herald.,01,1850-04-04,p4,Naval Inseuireues,,"We Learn that Cept. Tstnan passed through this
mand OF the splendid new steam frigate Sarspao. We
mentioned from pretty goed authority that this ship
proceeding South. We nov learn that orders have
been received for her to proceed direct to Norfolk and
che VIII leave ON Thursday or Friday for that port


The following 10 list Of her officers Josiah ratns,
Captain Lisutensnts, Thos w. Brent, Ovsrton Carr


william May, George Wells Surgeon Ninsn Pinck-
Assistant Surgeon, Marcus Duvsll; Passed Midship-
men, Samuel B. Elliott, John r. Hail. Thomas Reaey,
Augustus M. Laughlin; Mdshipmsn, John d. Rsiney,
Bancroft GheTardi James Greer Dc Grasss Livingston


John MoIntosh; Engineers-Chis Daniel Martin;
LIST Assistants J. w King, Michssl Quinn; I'd Assis-
tant, John Alexander; Sd Assistants, VIM. +. Lynch


Jr, Danisllr Mapss RiobsrdC Potts Edwin Fetheraui
Captain's Clerk, Josiah Tstnsl Jr Bostsw.in David
Grssni Gunner, - Carpenter Charles Bord'"
4_1850-01-29_p4_sn83030313_00271743014_1850012901_0143,The New York herald.,01,1850-01-29,p4,Passengers SaileN.,,"HAVANA. NEw ORLEANS AND CHAeREs- Steamship
Mr. Bates. Tath. d seeor, siga Fortunate Tedescs
sig'a kegira Tedesco Sr Malco Tedesco Franklin,
Rivers. Rivers II v franklin I Lss; Tensy, I
Lee, A D Mott, Davidson. 1 n Landes. Marley. P
Games Mrs Echezuira three Misses Eehezra Mr. Chsty
&c Wigsins W,iis, Davidson Reynolds pr hSChs:-
son. ton and feryant. numford and LADY, Mrs 2 n
REYNOLDS, Miss Gillette Hubbard Thomas Mr Ingalls,,
Beatty, Read, Duffy, J Cunningham. Mr. Gillespie
Foster, VIM Begs, VIM Payne, VIM Parsons, Lttls,
Clyne Smith, Smith, Weatherwax. Lynch, Mark
Ley. M Trne, w A J Bowling, Higgins, Eleus
Cole, VIZ Bobby. L9ckySod. Fsnnell, Mcsrids,
Ilypn, Patterson, II Hineman n uevon. u Gould.
PIesc9tt fr.nilis Ers lowell Norris. Ls fers,
2 ssnier. = Fielder. Z q ph0dehamsl. Smith. G Z
WWatiips, W oarhaIt, Holmss, W shsfer, Gehkin.


Wager, Russell Palmer. johnson, Psgan Pagan,
Pagan Mclaughlin. Leiglu, Shawk, r Gilmore.
Collier, Merrman, J Smith. n Payne Medium, j b
Robbins, Hubbard. Hoyt Mr. Emery. Bartlett, y
Rogers slonsOp, r Cults, Wempie y siratts. ?
Carroll Reese, Dowser, Mr. Braggart
Benney, Be.neyJ J Mcknight, Golden, Mailman.
R0verchulty, Berman, Leonard Senson, Mrs. Van
aewster John Norris Jshn Thomas, shafsr, Morsal
J Sleeper, Moody, Smith, w De Forest. Master
and niss De Forest Mr. snson, Of Adams Cos EIprsss
Total, us."
5_1850-12-31_p4_sn83030313_00271743026_1850123101_0932,The New York herald.,01,1850-12-31,p4,,,"


4. sis: :,s:
lin. Dsi:so; aiss:. q eissory. % clsrs.sss.' .' '' w.
l.sS...y n;' @ lss. S.s cs saS
s.srh Mobile. nurbut Co; Rose Standish. Magma.
slisssI.lvs. Ts p.rsh,i: Rss.:sd.I ~ Rsessa %s;:
sl: fss siss saq bsss
ress sIi Hu.shinssn Norioik. O Hamilton; Home
fs,siss bl.th.n. chasss. P:psn. ana: Railroad
Co Ih.ss 5 Brent cha; s Hsrfssa nsp
Ann Krsu; %ssnssSs Ef1sS: AID S.:
Yorh. GoOdsen. Boston. 49,.
y, Sss:t.'i:s sss:s $.Ssas .;.ss: ~ s ~ H.
Sailed IN g With :s: Snprs state aaa New Ys1S
Dec q ~ g. lon q 30 sss one Of tho cunArd steamers
ssg ssx IoIl !Il. IAsHp:.. as,rs Ny a. c.P' 4
nsshss heavy ne entire hove
boo board ress ssS das Dec D. s
mails with sssmship but could mAls the ssnai
Whit. s1S:s and sesY st,sr IN Der crs ana and main top
sale Dec e. otsn Bordes cabin passenger snAtivs Of
ship chsss. White ohsrl.sso,. days. with cotton and
Brig yuvsrns Br, Hsnnebury. New Haven days. in bal
Brig Hinss. Perry. Bath days


4 s;I:. Phil
sshr yohn Mh,. Green B.Iti.sr: a.: d,y, ssSns 70
~. River. frsia saturday night ioooan. Of hsss
ssIr WIN P.n. Turner H.rrlford NJ. ia.y. With n.y.
HhrrftOrd ba< probAoJ
but II Ia thought the vessel will be abandoned. -
sehr Dwight Davidson. Terry. New Haven bounds Viz
g,ia-


Schr Cordelia, smith, New Haven.


sehr Mary Anne Guest Holiness Providence bsuAd TO vr
gDiA-


schr susan, Hoit New Lon don, bound TO Virginia
sohr Harriet Chandler, Lynch, Boston, Is days.
Bchr Dushy Sally, Jenhins, salem, ~ days.
schr GENTLE, Low, kevburyport, bdays.


eobr Sea Lion, Brown, Rookland, IL days.


s.sI Ss.. ThSm.. ESs.l:.d ssia:. 70 ss.y.
fchr Lightfoot, Packard, RooHlsnd, days


Schr Gen Warren, BALL. kookland, IS dAys-


Bchr Mary Langdon, Ham. Rockland, ~ days.
echr Col Sinmons, Gutter RoeklAnd, IL days.
sebr Pawtucket, Ulner, Roeklans, IL days.


Scfr Pocassct, Parker Lubec. II days
tohr Enir Hall Calais. Is days, for Phifsdeipha
sloop Oregon, sturges, FrovideAoe.


Pit ship Splendid Higgins from Havre. with mdss and
passengers. 70 W wbitlook."
25_1850-06-27_p4_sn83030313_00271743014_1850062701_0837,The New York herald.,01,1850-06-27,p4,,,"Lynch. hiss csstise Hss csstns niss Resrdea. MY
LcnDosDnHnr-Brig Lsander-Dr Cochran Alsxa~As~
Cochran Miss Mary Cochran h she
Ellstt and child. - """
5_1850-07-06_p3_sn87090127_0029587756A_1850070601_0112,The organizer.,01,1850-07-06,p3,"OXFORD MALE ACADEMY.

NHIS Institution will be re.opened OF
4 Monday 18th June, (inst.",,"JNHIS Institution will be re.opened or
Il Monday 18th June, (inst.
he sui scrlber has the p 'easure Of annouI C
g to the public TINT he his associated "" itl
i'm, Mr.. NJ. J. LYNCH, gentleman pre-
qualified 20 teach the


CLASSICS, MATHEMATICS & SCIENCES
The Session will consist Of five months.


TERMS,


FIRsr CLAss.-Spelling, Reading, Wri-
hg, Elementary Geography and Ari hme.
&, $40 90
SECOND CLAss.-PraCtical Arith.
etc. English Grammar, and Ge.
raphy, coutinuei, $40 90
THIRD CLAss-N4tural and Nor.
Ph, Osophy, History, Rhetoric
Il Chemistry, S45 90
l'oURTH ss-EmhrGeing G |.
9e,'r Depariment.-M tthemal'cs,
oral Philosophy and Chep'str,,
ciIcing the Latin and Greek
nguagea, $50 90
|CcTFrench ianRht If required for hch
extra ehargeis made.


Board can be hid 10 the most respectable
niles for % per m nth.


JNO. W. RISON,
June Is, ls50.-16-n IL. Principal"
19_1850-06-11_p4_sn83030313_00271743014_1850061101_0759,The New York herald.,01,1850-06-11,p4,"Our Staten Island Correspondence.

STATEN IsLArp, June 10, 1850.
The Oyster VA.",,"SIArEN ISLAND, June ~, IooO.


The Oyster VA.


Agreeably TO my promise to keep you informed OF
the relative movements Of the beigerent parties in
this vicinity, will give you the outline Of their pro-
ceedings since my last After the ysiorous descent OF
the Bergen oyEtermen upon the Staten leland sloop,
and their still more yalorous rotreat there
pause In the Tho islanders through their coun-
sci commenced action in the Supree Court of The
State against some twenty Of the Jersey msrauicrs
and procured order for their arrest sul held them
10 bail In the rum of $4,000. But the nost Of them
too shr,wd for Sheriff, and either kept out Of
the state, or came under an assumed name However
several oi them taken into limbo, aud tho rest
will be secured.


In the meantime, the patriotic exp iition Of Lope.
TO Cuba too much for the military enthusiasm OF
Communipav- General Wright. OF Jersey City,
oommenced 90 drll his independent crrps OF Jersey
Blses"" and prepare thtir minds for any emerseney.
IL was und>F.too that Ia oasc btrsea county in
vadcd by The Staten iiEndcr. IN, slstm hell
rurg, sng the "" Elucsm 20 rush tn arms 0as
night ho~eycr, Jerscy wass, dountng the geuu-
men - 90 "" courage or p+fhtpa d-p SD J. nerve
them for The hour - Danger found eu uid grey horse
rhch haG b,sn TUNED ""t I"" dc, sTas'us On the eoH
mons, neaE L""tgsn oorrt house. ug""u TIE back OF
this ootrssr th'y mounted ""a brT. desss.d IA the
r.d shirt urhtlm ,f the oyst~rucu. aad &C tbs
Ehosty Lear q mfariktt, SsLt h.u at fan
fprtd q rr'use the srAton at the caurch doOr,
and 20 touIu thc totin - silr Jsrsey ,y a1d just
tunk INTO Ia sweet fignihrrs Of tha night
'llues vtTs atnifg o,r their victories be Won
Nhtn Tie itr. = iuuis were hrsld thgnd'rngo the
rEVcnrnfs ata the tpectrri courier da Airg s To the
cLu ch oo,'-"" Sound the bell sexton sound tAe hlr
the Staten I.afd-r> have d,sccn g Bergen point,r
In sn instant W., starlus pea,s ot enc tocso rang cut
frtu III Dla church tUwtr Jerseys valiant Sons
% l,r Vsrtnt SUES tatherd talok ami tat There
stood IN, ,ouri,r VERT BE oy,'ermaa aud there lay
hD gallant 'outpr, tSpl""g a. hs f,tt. Lite hal last
""a him ti 3D. Lfd deposited his rider at the door and
there ~ de red up hi life u III service 81 his
eouLtTy. Iui f'as! II oaly the peaceabie eiti-
IsBs that esther,d around that church dor. Tho
'Hluss sithsr too sleepy 20 b. a from the.r
beSs discsset 90 their s- ts the dangers
OF midnight mseh. came not rna from tat IA 1nrht
the joke aksd ont and toe oyaf'racn concluded they
could no i""ttrf rriy upoa the military arm Of the
country hut must rsurt g the civil power g. protect
their righw. sincc thrn the Jcrscy Blues have hai


on The 21ih n May the sheriff discovered to staten
Islsnd.skiGs. With a man aud boy In caca engaged
IN taking up osJttrs IN Newark Ray Urquictlv sum.
morsd ~. frsss Gus around him htranruoi then,
10 Their ughtr Be-Eensrs aud thc.r dJtir1 de-
sesndants o th, Jtrttytn, Of the revolution and then
quietly tscr,ttd about tfty 81 thrm on board
d,rtd 60 srn In diG .rrut directions. nna q beat
around 10 thc wudsard of the bnsts. cutting on
their retTsSt 90 she i-lau aud then % d,sconl Ia
curved line upon them. Tue moTsuirnt vs. executed
in gallant yle aud proved The sheriff O. b. master
81 naval itcies The uutoftunste boats weT' cap
tursd bf.iC tlrir iumsts were sWare - the hostile
uovcmtnt and we're taken Ashore. Thcr'st0oi = Ber-
gen justice. Who Rad h.s ur -ss ready eud the un-
lucky oyttttmcn sent O. .hr Bergen jail unlrr
proper etc,t. The Bcrrcntrs 90 tuto iniliacatou
irtm Which they have jet scarcely recovered The
vourtti n t iiaudrr. but before Sc could o. ssrred
the legal sdviftr ~ tie Justice Who committed the
men. told O. be lad trtttr cifcharge the men. n
would iI'n De ff gcra and they acrofdiugy se
at liberty. The lolts kept. ana au examination
bsd. which ftsuttd in no particular injury except
that the Ifsty men removed ia lynch pias fum the
carriage q the staten Islsrd witness and came
near Breaking their uscts The Justices knew cf no
other vty 90 get their cosr. except ty connscatug
the hcais which they ava accofdirgy The Islander,
are con piled 90 resort 90 the lsr fcr rcacGy and
warrant ats CUT nlntuft oil pariirr concerned


Since a. q rruy of dftVtrHduHs idouiru1y took
two ioufs. which w,re qui.fy drawn up the beach
iy some t1 ftttutn and have fttfctHd them ia some
Visce uf tLHvn. Eut a. this c1ts uuDr the criminal
jurfd q the cCUnty. they will De- punished Ia
due form 90 Jaw.


Thus stand msittrs et prefeut. oihcr proceedings
are 90 BE- talsn tC- q which you shall De duly la
formed"
11_1850-05-25_p6_sn83045784_00415661599_1850052501_0201,Weekly national intelligencer.,01,1850-05-25,p6,"APPOINTMENTS BY THE PRESIDENT.
By and ,Dith the adpice and consent ofthe Senate",,"By and Uith the aduice and consent offhe Senate.
|, GEORGE Folsom, of New York, TO be Charge
d'Affaires Of the United States of America at the
Court of his Majesty, the King of the Netherlands
JOHN SUMMERS SMITH, of New York, to be Con-
sui of the, United States for the port of Malaga in
Spain.


GEORGE MoUNTFoRT, of Massachusetts, to be
Consul of the United States for the Island of CANDIDA


PosTMAsTERs.
CHARLES Il. MADDOX, to be Postmaster at Balti-
more, Maryland.


WILLIAM M. BLAcKFoRD, to be Postmaster at
Lynchburg, Virginia.


FREDERICK w. SMITH, to be Postmaster at
Houston, Texas.


UNITED STATES MARsHALs.
Thomas s. HALL, for the eastern district Of
Virginia


CHARLES BINGHAM, for the southern district of
Alabama.


WILLIAM McQU1sToN, for the northern district Of
Mississippi.


HENRY F. TALLMADGE, for the southern district
of New York.


ANTHONY E. ROBERTS, for the eastern district of
Pennsylvania


CHARLES H. KNOX, for the district of Michigan.


ATTORNEY.
WILLIAM H. CApERToN, for the district of Ken
lucky."
6_1850-10-12_p3_sn82014892_00393342870_1850101201_0083,Southern shield.,01,1850-10-12,p3,$ 35 IsaLEV ARD.,,"STOLEN, from the subscriber, on the night 'S of the 1lth inst, at fernando, l. Soto county, Miss, large bay Horse, about years old, both hind feet white; good saddlo and work horse. This horse was stolen by imam who called his name Wm. Lynch, of the l5l- lowing ription:-About six feet high, z years of age, weighs about lG0 lbs; light hair, large dull grey eyes; has had his right arm bro- ken, which Is somewhat stiff. He also took an uncovered Spanish Saddle, and fine double roined brdIe, with curb chain.

 He crossed the Mississippi river at Helena or Delta, think, and is no doubt somewhere in Arkansas.

 will give a reward of S35 for the delivery of the horse and thief to me at fernando, or $lO for any information that may lead to the recovery of the horse alone; and $25 for the detection of the thief if lodged in any Jail.

 A. s. BAILEY.

 CH Al O"
5_1850-06-30_p4_sn83030313_00271743014_1850063001_0849,The New York herald.,01,1850-06-30,p4,Passengers Arrived.,,"Gi4seoy.s.eamshiP c,,y Of GlsssoT.x.s Mary covA.
, TT kBa ssi & ,;s;
S.sd Miss Mary Ann Miss EasSsss c.shrss
Samuel Cochran George Parker George Mlburne. Ms
j. simon stFog.. 5ohn ssupds5,. Alex brown
Robert Ha j. Robert Reufrew Q Gmour. a stoddard,
Grace aes,mon. Miss Mary Colisy. John Scott ch.rI
yss hss Sa1 Sissis k:sitsy
Req & Nj. asnas M,d Master Jss. Riss JOSIAH ss:l
snissr. Penn, VIM n.rfow:r -. ANN hsrroys D.
jIs3 sS Ths%s w.':on shS h,a foSs5 cs.Ss


Sd s'i Ton sa as soSs osn
hSranret Crohon Miss Crsteua sarsares Scott
pn MT Mss E% S


RS: pDf1s Ssr DSGs1
AsGas ASH1S ROM Tss s lssy
n s.s john MI. A%a
ey ksemGno Kersiiy nr; keysay res, RSy ss's d..
ssi 1ssR g9arssss nss W. t.sSs. r.s
I.sIgSeNsea%.GiP ns:n. s,enapn-ycA4 sehu,.
frsn,der Rciher and family Ir ysisef aud BroSa.


sey f in the % ses""na s.so .nd .,s.f


hess s.. %s-S s.s Ss es, NJ
Wosd Iiss Srd, ss. Sarss s's idsn and sst,sn an


ssiPas eso ss s .s %S'dsH5y $ssy h;ii.
nail' sresr, Tent Jorean, Toter. Iiasokeb aead
child herrell 0cdbury. STARK md frcac oxAr Blai
and daughter, TatnNll UsN, and laay n T. FAIRY a.
lady Clay Jr. snd lady Caller snc law w Crowds
LADY and servant Richards yi,sgeFa., Tatnsli.
=. p T,tan y, &c Hs%il,Os, 7 s.niisan, Me.
Chambsrlin, Craven, II hardy, iisli Fontain
lawer. Atwood. II roes, Allen, II Hoodiey, n
Harrison, Lynch, W CLARK, y Robins X w Cooper
Burpss, Bsaiue, sA james Robinson, J n Ford, X
Roberts, Nc Rea. ard % an the steeraxe.


LyrRTooL--sbir Isaac Wright~-'sps N Watson. N +.
Condor. Miss N Condou. Mics Nrel Sullivan. Clr
Old Chpold Potter. Bosart Jrise in the sevras


LivsnrooI-Ship EsmerAlda-Dr Morrei Rev Mr. Nc asnc
my-.s5 IN tie storage.


Nkw ORLKASs-Ship Gaiena-Henry p Andrews Mrsu
Virgins, Miss Virgins. I'm l. bAlfour. Mrs Kate Ba
four, Hiss Hunt Ahijah Hunt servaut, Miss Ann
Clsttorne, Mr., "" lngrahan Miss . Ingraham, Nj a
Charlotte Wilsor, Nifs II Wilson, Yrs Davldso
John Dcrmsn, Patrick Fanning, Mrs "" X Dsmnan, N
Deveresun Ellen suliiyan-.j IN the stesrsgc.


SAvhsrtH-Bark Eksot-Mrs Rs erson Mics PArkham st
srvant Mise Halsey STILES, MIRA George and shiidIe
Miss Dvuhsm, Miss Mitchell Miss DEMPSEY Mr. and -
Rafotd George Miss falligaut Mrs Wizard and ohl


susisAa-iiris Dsinont Looke-Mr Levy Lyons Mr. HR
fep 1efn"
