article_id,newspaper_name,edition,date,page,headline,byline,article
5_1840-02-29_p3_sn84020750_00416156888_1840022901_0210,The North-Carolinian.,01,1840-02-29,p3,,,"sufficiently awake, and while she slumbers,
all the vigils of the watchn1an will be in
vain.


The suspension of the right of petition,
the suppression of the freedom of debate; the
thirst for the annexation of Texas, the war
whoop of two successive Presidents of the
United States against Mexico, are all but
varied symptoms of deadly disease, seated
In the marrow of our bones; and that deadly
disease is slavery. THE UNION WILL
FALL BEFORE IT, OR II BEFORE
THE UNION The abolition of slavery
in the District of Columbia, or in the Terri
tory OF Florida, the prohibition of internal
piracy between the States, the refusal to admit
another slave contaminated State into the
Union, are all partial ineffective plasters for
the great elemental evil.


""rhey will but skin and film the ulcerous part.
While rank corruption, mining all within.
lnects unseen.'


believe it important that the inhabita ats
OF the Twelfth Congressional District of Mas
sachusetts should be forewarned, that during
the 26th Congress the whole system of the
Executive Administration of the Govern
ment of this Union, and all its prominent
measures, foreign and domestic, will be, as
they have been, and now are, to support,
strengthen, and Perpetuate the regular institu-
tions of the South. The determination of the
Indian race; the wasteful dilapidation of the
public lands; the deadly hostility of internal
Improvement; the insidious crippling of do
mestic industry; the ridiculous imposture of
an exclusive metallic currency for the reve-
nues and expenditures of the nation; the
enormous increase Of a standing army, and
the simultaneous ISLANDERS upon the navy and
its gallant officers; the sycophantic courtship
OF the democracy of numbers, and the ran
corous lnstlgatlon of labor against capital 10
the summary justice of lynching-all these
ways and means of Northern Administration
with Southern principles, have one and the
same origin, and are gathering to one issue
the rlvetlng In enternal bondage the chains Of
your Southern countrymen of African decent."
15_1840-01-14_p1_sn82015015_00415661265_1840011401_0032,The Madisonian.,01,1840-01-14,p1,"DR. GoopE's

CELEBRATED FEMALE PILLS.",,"These Pills are strongly recommends TO the notice Of
the Ladies safe and efficient remedy in removing
those complaints peculiar TO their SEX from Of
else, general debility Of the system distractions sup
prcssons, and rregulary of the menses; at the
me STRENGTHENING cleansing and giving tone to the sto
mach and bowpis, and producing new and healthy
ton throughout the system generally. They appe
lite, correct indigestion giddness and those
plants which distress females much at the turn OF
e They obviate costiveness, and couneract all hys
terical and nervous affections, likewise afford soothing
and permanent relefn uor abus, and in the obst
nate cases OF green sickness they invariably
restore the pad and delicate female to health and vgo
These Pills have gained the sanction and appreciation
Of the most eminent physicians in the United States and
mothers can likewise testify to their extraordinary
efficacy. To married females whose expectations Of the
enderest pledges Of communal happiness have been de-
eated, these Pills may be truly esteemed blss boon
They soon renoyae all functional debility and if taken
according 10 directions obyiate all morbid action.


Dr. Goode's Celebrated Female IaiHs-arc for all
the following diseases Suppression. irregularty or
retention Of the menses, fuor abus, chorosis green
sickness, cosveness gravel ncontinence Of urine
vous affections, Mysteries, proapsus uer or falling Of
the womb and piles also, pains in the SIDE
head, stomach back dimness or confusion OF sight
alternate ushes of heat and chilness tremors watch
ngs agitation; anxiety bad dreams and spasms Tins
medicine is acknowledged to be Of the most valuable
discovered purifier Of the blood and fluids
superior to sarsapara whether as sudor6c or ahera
tive.


Agent LEWIS JOHNSON, Washington, D. C.
Interesting and applicable to The afflicted, ,cith disco





chronic Casual under the symptoms OF restless
s~lowness OF Spirits and general emacation; Con
sumption, whether Of the Lungs or Liver; Liver Aec
tons; Jaundice, both hillary and spasmodic
Worms of every variety Rheumatism, whether
chronic together with Gout Scroula pains in the head
back, limbs and side Typhus Fever; Scarlet do Purid
the Heart and Arteries. Nervous Irritabiy, Nervous
Weakness, Mysteries, Tic Douloreux Cramps, Female
Distractions, Heartburn, Headache, Cough, the
or humid AZ the Dry or the Whooping Asthma Gravel
and Dropsy.
The blood has hitherto been considered by empyrcs
and others, the great regulator of the human system
and such the deyotedness of the adherents that
neous doctrine, that they content themselves with the
simple possession Of this faacous opinion, without
qiring into the primary sources from whence life he ah
and vgor emanate and pain sickness disease
and death Not with DR.. Hunt, whose extensive re-
search and practical experience emneny qualify him
for the profession Of which he has been Of the most
useful members. He contends land moments rehcc
ton will convince reasoning mind Of the
of his viewsthat the stomach liver and the associated
organs are the primary and great regulators of
that the blood in veIy many Instances is dependent on
these organs and that unless medicine reaches the root
OF the disease the superficial anodyncs usually prescrb
ed serve but to the avages ofdeeprooed maades
Under these convictions, at the expense Of years Of close
application, the doctor has discovered medicine whose
searching powers irresistible and in prescribing II is
with knowledge Of its being radical in the various
diseases already enumerated, f applied in the most
critical cases, but he do pretend ascribe to Hunts
Botanic Pills, supernatural agency although from posi-
tive proofs within the knowledge Of hundreds he is pre-





been given up Hunts Botanic Pills have never been
known to fail in efecting two very gratifying results that
OF raising from the bed OF sickness and disease those who
have tested their efficacy, and thus amply rewardnz DR.
Hunt for his long and anxious study attain this pocc
tion in the healing


Agent, LEWIS JOHNSON, Washington, d. c.
Dr. Evans Camomlo and Aperient Pills,


j"" Evans Fever and Ague Pills,


+"" Evans Soothing Syrup,


="" Goodies Female Pills,


"" Hunts Botanic Pills,


entered according 10 act of Coagress and ar,
pended oniu al 100 Chatham street. Ncc York or at the
regular agents.


G. HALL, Norfolk


+ Z. PORTLOCK, Portsmouth,


JOSEPH GILL Richmond


MORTIMER & MOWBRAY, Baltimore,


JESSE PERRY Suffolk,


LEW is JOHNSON, Washington, ID. c.


M. THRIFT Il Co, Petersburg,


JONM N. BELL. Winchester Va


WILLIAM DORSEY, Mar,insburg, Va


EDWARD MCDOWELL, Fredericksburg, Va.


T. BERKELEY 4 Co, Harrington, Va
J, HARDISTY, Hanisonburg, Va.


JAMES BROWN, Charleston, Va


c. & +, DUNKUM. Lexington, Va
BARRETT q MCINTYRE, Charlottesville, Va


LYMAN, Lynchburg, Va


g. CRUIkSHANK, Georgetown, d c.


BELL. q ELLSWORTH, Alexandria ID c. ly20"
5_1840-08-13_p2_sn84020071_00414182951_1840081301_0124,Litchfield enquirer.,01,1840-08-13,p2,AMERICAN STATESMEN.,,"prodigious eyes, those heavy shoulders Inat iron built frame, point out Webster. How like Satan himself he can look, ana what malicious smile! He talks as if he were telling a plain story, not enthusiastic Dut concise and clear. His arm comes up as lifted by spring. He speaks like one rom the grave-So solemn and so seVeIe. AmO"" the lion is aroused. What a voIce The sentences leap into life, with well-timed met anhor. skillfnllv interwoven-all perfectly wrought out. Yet Webster is man ot no imagination. He has a well-dsciplined taste and give him clue to figure, ana he will trace it with force and beauty""

 CALHouN.-"" That slender built man, ap- parently about fifty years of age, in blue coat, with bright buttons, frIzzly head' ana an eve like a hawk, erect and earnest, with mouth partly open-that is Calhoun. lie is not an orator-yet few command so much attention-none more; his voice is bad; his gesticulation is without grace. He IS zeal- Ous and enthusiastic, but without being iran. tic his apparent candor, earnestness ana sincerity command attention; ms Volce ! struggles in his throat, and you almost un. derstand the thoughts swelling there and they soon rush out as fast as words can con- yey them. He speaks in debate, as farmer in earnest, would talk to his boys, or mer- chant to his clerks. .,

 CIAY.-"" That tall, we'll l-formed man, with a wide mouth, and countenafce indicating every change of thought within, is Clay. He has been so often described, that shall dwell upon him briefly, here. Nature made him an orator to figure in a free government: In despotism, his head would have reached the block for his impudence before ne was thirty. He is good at every thing; nth'I te. tiget, q,.od non or nGrit. have never heard such voice it is equally distinct and ciear' whether at its highest key or lowest whisper rich, musical and captivating; his action 1 is the spontaneous offspring of the passing thought. He gesticula.es au Orer. The holding of his head, hung on long neck his arms, hands, fingers, feet, and even his spectacles and pocket-handkerchief aid him l in debate. He steps forward and backward, and from the right to the left with effect Every feature speaks. The whole body has it's story 10 tell.

 PREsroN.-""T That tall, red-headed man, with large, manly figure and full face, IS Preston, the member from South Carolina = He looks as if he had long lived under the rays of southern sun. Preston IS sn' gene. ris. He talks poetry, all in rich array and gorgeous sentences. When there IS a storm in the Senate they hang him out as a rain bow and although the rough clouds often darken his glittering hues before the storm is hushed, hot tempers are cooled and spirits are softcncd, by the dazzling arch and the rich interlacings of his bow. His is unPre- meditated elequence. He does not. like Sheridan, mark in his orations the place 10 introduce Good God! MT. Speaker The incidents of debate suggest all his fine sen- tences; his gestures are admirable. No American orator is more graceful-tew have more art; and yet few understand so we'll the 0rs celGre Grtem. Such man was necessary in the Senate. All the kinds ot eloquence that Cicero describes. are now exemplified and illustrated in that body, and no two are formed on the same model""

 Real Alarms Leaking Ouf.-An eastern loco iocC, just returninprom the south and esi met friend Mr. -, n veteran whig, and supposing him to be Mr. Lynch oi onr s''y S s.a n name is MT. of Chester county, and 3 am l;s; % re turned from the west on my way oaS ,h. Ohio Indiana and illinois may be considered as SSe been ""1Es through @ e@ S and rom dgen nqu "" have ss we a, goes for Harrison of course"" ""Wha, news have you from Tennessee 2"" ""Iwas through part of Ten sion that the whigs will carry their electoral ckct.- Bu, still Van Buren is safe. He wiI! ge,, PennsSyya- south, and we can afford to give them the west"" ""I those . large states you mention Indeed do you think so, Mir. Lynch"" My name is not Lynch. though something like it. It is-."" 70. lknow all the time to n staunch Harrison man."" You have, sir"" ""Well, t can't be helped now-le,'s take drink"" ("" will look at you. SIT. hut never drink"" We vouch for ,he truth of ,he above, which occurred at the Exchange last week, and can give names, if eccssary.-PItsb""rgh American.

 From the Gloucester Telsgraph.

 Bishop Soule's Opinion ot Gen. Harrison.-We ask you to look at the following statement Of facts =

 Bishop Soulc, D. D., of the most pure and dis tingushed Me,hods,s in the U. S., was asked n the presence of the Rev. Leonard B. Grifng (who here"
11_1840-01-01_p1_sn82015015_00415661265_1840010101_0016,The Madisonian.,01,1840-01-01,p1,"DR. GooDE's

CELEBRA TED FEMALE PILLS",,"These Pills strongly recommended TO the notice OF
the Ladies safe and efficient remedy in removing
those complaints peculiar their sex, from of
cise general debility Of the SYSTEM distractions sup
pressons, and reguarity of the menses; at the


time Strengthening, cleansing and giving tone to the
mach and bowels, and producing and healthy C.
throughout the system generally They create appe.
lite, correct Indigestion, giddness and those
plants which distress females much at the turn Of
ie They obviate costiveness and all hys-
erlcal and affections. likewise afford soothing
and permanent relein tluor albus and in the o'
nate cases OF chloross,or green sickness they invariably
the pald and delicate female health and yignr


These Pills have gained the sanction and appreciation
OF the most eminent physicians in the United States and
many mothers can likewise testify to their extraordinary
efficacy To married females, whose expectations of the
tenerest pledges Of communal happiness have been de-
eated these Pills may be truly esteemeda bissfn boon.
They renovate all functional debility and If taken
according 10 directions, obyiate all morbid action.
Dr. G5ode's CeleJratcd Ecasae PiHs- are for all
the following diseases: Suppression rregularity or
retention Of the 1uor albus chloross green
sickness costiyeness, gravel lnconnence OF urine
affections, Mysteries proIapsus uteri, or falling of
the womb and piles also pains IN the side, chest limbs
head stomach back dmness, confusion Of sight
alternate hushes Of heat and ohilness tremors watch
| ings agitation anxiety bad dreams and spasms This
medicine is acknowledged to be Of the most valuable
discovered purifier of the blood and fluids it IS
superior to sarsaparla, whether as sudortc a,era
tive.


Agent, LEWIS JOHNSON, Washington, d. G.


Interesting and appi,eable 10 khe afflicted th disea
Of HE stomach or ncrres, such Dyspepsia either
chronic Casual under the worst symptoms Of restless
ness lowness of Spirits and general emaclaton Con-
SUMPTION whether Of the Lungs or Llver Liver Afec
tions; Jaundce both hillary and spasmodic Cosivencss
Worms OF every variety Rheumatism, whether acute
chronic, together with Gout Scroiua, pains in the head
back limbs and side Typhus Fever; Scarlet do; Purid
Sore Throat, Fever and Ague, Spasmodc Papltaion OF
the Heart and Arteries, Nervous lfrtahity Nervous
Weakness, Mysteries, Tic Douloreux, Cramps, Female
Distractions Heartburn, Headache Cough, the common
or humid, the Dry the Whooplng; Asthma, Gravel
and Dropsy.


The blood has hitherto been considered by empyrcs
and others, the great regulator OF the human system
and such the devoedness Of the aherents to thar
neons doctrine, that they content themselves with the
SIMPLE possession OF this faacous opinion, without
qnirng INTO the primary sources from whence life, health
and vgor and pain, sickness disease
and death Not with DR. Hunt, whose extensive re.
search and practical experience emneny qualify him
for the profession OF which he has been OF the
useful members. lie contends land moments re1ec.
ton VIII convince any reasoning nina OF the correctness
of his viewstha the stomach liver and the associated
organs are the primary and great regulators Of heahand
that the blood in many Instances is dependent
these organs and that unless medicine reaches the
OF the disease the superficial anodynes usually prescr-
ed serve but to the deeprooed maades
Under these convictions, the expense of years of close
application, the doctor has discovered medicine whose
searching irresistible and in prescribing it
with knowledge ofts being radical cure in the various
diseases already enumerated if applied in the most
critical cases, but he do pretend ascrbe 10 Hunts
Botanic Pills supernatural agency although from posi-
tive proofs within the knowledge Of hundreds he pre-
pared to show, that when every other earthly remedy has
been given up Hunts Botanic Pills have never been
known 10 fail IN eecilng two very gratifying results that
OF raising from the bed of sickness and disease those who
have tested their efficacy, and TINS amply rcwardng Dr.
Hunt for his long and anxious study attain this peec-
tion in the healing art


Agent, LEWIS JOHNSON Washington, d. c.
Dr. Evans Camomlo and Apericnt Pills,


Evans Fever and Ague Pills.


/"" Evans Soothing Syrup,


/"" Goodies Female Pills.


/"" Hunts Botanic Pills,


are entered 0rcordipg 10 act of Congress and are
readed onip at 100 Chatham STREET. Netc York or al The
regular agents.


c. HALL, Norfolk,


f. T. PORTLOCk, Portsmouth,


JOSEPH GILL, Richmond


MORTIMER & MOWBRAY, Baltimore,


JESSE PERRY, Suffolk,


LEW is JOHNSON, Washington, d. G.


NJ THRIFT & Co, Petersburg,


JONM n. BELL. Winchester, Va.


WILLIAM DORSEY. Marnsburg, Va


EDWARD MCDOWELL, fredericksburg, Va


Il BERKELEY x Co. Harrington, Va.


J. HARDlSrY, Harisonburg, Va.


JAMES BROWN, Charleston, Va.


G, q l. DUNkUM. Lexington, Va.


BARRETT & MCINTYRE, Charlottesville Va


LYMAN, Lynchbug Va


G. CRUIKSHANk, Georgetown, ID &,


BELL. Il ELLSWORTH Alexandra, ID G. Iy20"
7_1840-01-04_p1_sn82015015_00415661265_1840010401_0020,The Madisonian.,01,1840-01-04,p1,"DIR. GooDE's

CELEBRA TED FEMALE PILLS.",,"These Pills are strongly recommended 10 Tie notice OF
the Ladies as safe and efficient remedy in removing
those complaints peculiar 10 their from want of
else, general debility OF the system, obstucons, sup
pressions, and rreguarity of the menses; al the
time, Strengthening, cleansing and giving tone to the
mach and bowels, and producing and healthy
ton throughout the system generally They appe


lite, digestion, remove giddiness and those
plants which distress females much at the . OF


e."" They obviate cosveness and counteract all hys
terca and nervous affections likewise afford soothing
and permanent rehefn uor albus and in the most obs
of choross,or sickness they invariably
restore the pad and delicate female TO health and vgor


These Pills have gained the sanction and appreciation
OF the most eminent physicians in the United States, and
many mothers can likewise testify to their extraordinary
efficacy. To married females, whose expectations Of the
enderest pledges of connuoia happiness have been de-
eated, these Pills may be truly esteemed bliss boon
They renovate all functional debility and il taken
according TO directions, obvate all morbid acton.


Dr. Goodc's Cclc6ratcd Female PiHs--are for all
the following diseases: Suppression irreguarity or
retention of the menses auor albus, chorosls green
sickness, costveness gravel inconnence OF urine ner
affections hysterlcs proiapsus utcr or falling OF
the womb and piles also, pains IN the side chest limbs
head, stomach back; dmness, confusion Of sight
alternate fushcs of heat and chlness tremors; watch
ngs agitation anxiety bad dreams and spasms This
medicine is acknowledged be Of the valuable
discovered purifier OF the blood and fluids II IS
superior to sarsapaia' whether as suuor'W or aiteFa
tive.


Agent LEWIS JOHNSON, Washington, D. q


Interesting and applicable 10 The afflicted, ph diseas
II e stomach nerpes, such Dyspepsia either
chronic Casual under the symptoms OF restless
ness lowness OF Spirits and general emaciatlon Con.
sumption, whether ofthe Lungs or liyer Liver flee.
tions aundice, both hillary and spasmodc Costvencss
Worms of every variety Rheumatism, whether acute or
chronic together with Gout Scrofua pains in the head
back, limbs and side Typhns Fever Scarlet do, Purd
Sore Throat, Fever and Aene Spasmodc Papitaion o.
the Heart and Arteries Nervous Irrltabiliiy Nervous
Weakness, Mysteries, Tic Douloreux, Cramps Female
Distractions Heartburn, Headache, Cough, the common
or humid ard the Dry the Whooping; Asthma, Gravel
and Dropsy.





The blood has hitherto been considered by empyrics
and Others the great regulator OF the human system
and such the devotedness of the adhcrents 10 that
neous doctrine that they content themselves with the
simple OF this allacious opinion, without IN
quirlng into the primary from whence life, ah
and vigor and vice pain sickness disease
and death Not with DR.. Hunt, whose extensive
search and practical experience emneny qualify him
for the profession OF which he has been Of the
useful members He contends -and moments rehec.
ton will convince reasoning mind OF the correctness
OF his vewsthat the stomach, liver and the associated
organs the primary and great regulators OF heath.and
that the blood in vey many Instances IS dependent
these organs and that unless medicine reaches the
Of the disease, the superficial anodynes usually prescrb
cd serve bu, to ravages ofdeeproo'cd maades
Under these convictions the expense of years of close
application, the doctor has discovered medicine whose
searching powers irresistible. and prescribing is
with knowledge OF It's being radical cure in the
diseases already enumerated, il applied in the
critical cases but he do snoi pretend to ascrbe 10 Hunts
Botanic Pills, supernatural although from posi-
tive proofs within the knowledge OF hundreds, he pre-
pared Show that when every other earthly remedy has
been gwen up, HUNTS Botanic RMS nave never been
known TO fail in efectng two very gratifying results. that
OF raising from the bed OF sickness and disease those who
have tested their efficacy, and thus amply rewardny Dr.
Hunt for his long and anxious study 10 attain this perec
tion in the healing art


Agent, LEWIS JOHNSON, Washington, D. c.
DR.. Evans Camomlo and Apcrent Pills,
I"" Evans Fever and Ague Pills,


="" Evans Soothing Syrup,


!"" Goodies Female Pills.


:. Hunts Botanic Pills,


are entered according Ia act Of Congress and are
rcndcd oniu al 100 Chatham street. Nem York. or al the
regular agents.


G.. HALL, Norfolk


+. PORTLOCK Portsmouth,
JOSEPH GILL, Richmond,
MORTIMER & MOWBRAY, Baltimore,
JESSE PERRY, Suffolk,
LEW is JOHNSON, Washington, d. G.
NJ THRIFT & Co. Petersburg,
| JONM N. BELL, Winchester, Va.
WILLIAM DORSEY. Marlinsburg, Va.
EDWARD MCDOWELL. Fredericksburg, Va.
+ BERKELEY & Co, Harrington, Va
j HARDISTY, Hausonburg, Va
JAMES BROWN, Charleston, Va
| c. & T. DUNkUM Lexington Va
| BARRETT & MCINTYRE, Charlottesville, Va
LYMAN, Lynchburg, Va.
| C. CRUIKSHANk, Georgetown, D. G.
! BELL. g. ELLSWORTH, Acxandria, d. G. Jy2o"
36_1840-11-26_p3_sn84020071_00414182951_1840112601_0181,Litchfield enquirer.,01,1840-11-26,p3,"DIED,",,"In Cornwall. on the 7th inst. in the Goth year of her age Mrs. Sarah Calhoun, rehct of the late Doct J. Calhoun. She was ever amable; for long course of years she sustained public profession of christianity with uncommon gentleness. meekness, discretion. and christian proprie,y. While her mem

 In Red River Landing. Lou on the 22d uIt. Dr, Joseph Adams May. aged 24 years. son of MT. James May. of Bath. N. Y.. formerly of this village.

 Near Lynchburg Texas on the 18th of May, Mrs. 42, formerly of Litchfield."
