"url","title","snippet"
"https://www.dailywire.com/news/kamalas-most-insane-plan","Kamala's Most INSANE Plan","Sep 25, 2024 ... US Vice President and Democratic presidential candidate Kamala Harris boards Air Force Two at Joint Base ERIN SCHAFF/POOL/AFP via Getty Images. Kamala Harris ..."
"https://www.dailywire.com/news/lip-reader-suggests-biden-obama-may-have-dissed-kamala-at-ethel-kennedys-funeral","Lip Reader Suggests Biden, Obama May Have Dissed Kamala At ...","Oct 18, 2024 ... ... a not-so-flattering discussion about Vice President Kamala Harris. According to Jeremy Freeman, a forensic lip reader who was born deaf and has served as a ..."
"https://www.dailywire.com/news/cnn-scorches-kamala-for-using-trumps-border-wall-in-campaign-videos","CNN Scorches Kamala For Using Trump's Border Wall In Campaign ...","Sep 5, 2024 ... Vice President Kamala Harris, after years of decrying former President Donald Trump's border wall as racist and un-American, is now using footage featuring ..."
"https://www.dailywire.com/news/kamala-harris-husband-admits-to-impregnating-babysitter-while-cheating-on-first-wife","Kamala Harris' Husband Admits To Impregnating Babysitter While ...","Aug 3, 2024 ... Vice President Kamala Harris' husband, Doug Emhoff, admitted that he cheated on his first wife with the couple's babysitter after a report was published on ..."
"https://www.dailywire.com/news/st-kamala-tries-to-laugh-off-hot-mic-moment-at-a-bar-with-gretchen-whitmer","'S**t!': Kamala Tries To Laugh Off Hot Mic Moment At A Bar With ...","Oct 27, 2024 ... Vice President Kamala Harris got caught on a hot mic while chatting with campaign surrogate and Governor Gretchen Whitmer (D-MI) — and then tried to laugh it ..."
"https://www.dailywire.com/news/kristen-welker-slammed-for-lying-about-harris-attending-dignified-transfer-of-13-fallen-soldiers","Kristen Welker Slammed For 'Lying' About Harris Attending Dignified ...","Sep 2, 2024 ... NBC News' Kristen Welker was slammed over the weekend after she falsely claimed that Vice President Kamala Harris attended the dignified transfer of the 13 US ..."
"https://www.dailywire.com/news/biden-harris-administration-pushed-far-left-ideology-with-500-dei-actions-report-finds","Biden-Harris Administration Pushed Far-Left Ideology With 500 'DEI ...","Oct 31, 2024 ... WASHINGTON, DC - JUNE 28: Vice President Kamala Harris speaks onstage during a Pride (Photo by Tasos Katopodis/Getty Images for GLAAD). The Biden-Harris ..."
"https://www.dailywire.com/news/cautiously-optimistic-ben-shapiro-talks-to-megyn-kelly-about-early-election-results","'Cautiously Optimistic': Ben Shapiro Talks To Megyn Kelly About ...","Nov 5, 2024 ... Kamala Harris can't even make a case for Kamala Harris.” Kelly pointed out that some exit polls showed voters put the economy and immigration as their top ..."
"https://www.dailywire.com/news/kamala-snubs-al-smith-charity-dinner-sends-video-instead","Kamala Snubs Al Smith Charity Dinner, Sends Video Instead","Oct 17, 2024 ... Cardinal Timothy Dolan revealed this week that Vice President Kamala Harris has not changed her mind and will snub the Al Smith charity dinner on Thursday ..."
"https://www.dailywire.com/news/defending-kam-unism","Defending Kam-unism","Aug 29, 2024 ... The entire Kamala Harris campaign relies on you knowing nothing about Kamala Harris. First rule of Kamala Harris Fight Club: Nobody talks about Kamala ..."
"https://www.dailywire.com/episode/daily-wire-backstage-the-fight-for-47","Daily Wire Backstage: The Presidential Debate","Sep 10, 2024 ... Donald Trump and Kamala Harris go head-to-head in a historic face-off, clashing over key issues like inflation, abortion, and immigration."
"https://www.dailywire.com/news/the-best-takedowns-from-ben-shapiros-showdown-with-25-kamala-voters","The Best Takedowns From Ben Shapiro's Showdown With 25 ...","Oct 24, 2024 ... Daily Wire Editor Emeritus Ben Shapiro entered the lion's den in a video posted on Thursday, taking down arguments made by 25 Kamala Harris supporters on ..."
"https://www.dailywire.com/news/ben-shapiro-breaks-down-kamala-harris-fox-news-interview-full-scale-disaster","Ben Shapiro Breaks Down Kamala Harris' Fox News Interview: 'Full ...","Oct 16, 2024 ... Daily Wire editor emeritus Ben Shapiro reviewed Vice President Kamala Harris' interview on Fox News after it aired on Wednesday evening, ..."
"https://www.dailywire.com/news/joe-rogan-kamala-was-supposed-to-do-my-show-has-not-showed-up","Joe Rogan: Kamala Was 'Supposed To' Do My Show, Has Not ...","Oct 26, 2024 ... Podcast giant Joe Rogan said on his show this week that Vice President Kamala Harris was already “supposed to” come on, but has so far not shown up."
"https://www.dailywire.com/news/open-letter-to-taylor-swift-research-harris-and-walzs-anti-woman-abortion-extremism","Open Letter To Taylor Swift: Research Harris And Walz's Anti ...","Sep 11, 2024 ... However, your recent Instagram post endorsing Vice President Kamala Harris and Minnesota Gov. Tim Walz and your stance on a “woman's right to her body ..."
"https://www.dailywire.com/news/trumps-israel-ambassador-criticizes-jews-who-think-kamala-better-on-israel-fighting-anti-semitism","Trump's Israel Ambassador Criticizes Jews Who Think Kamala ...","Nov 1, 2024 ... ... Vice President Kamala Harris doesn't “really believe in the cause, in the ultimate justice of a Jewish state.” “When we left office, Iran was on ..."
"https://www.dailywire.com/news/commerce-secretary-gina-raimondo-suggests-trump-made-up-numbers-that-bidens-labor-dept-released","Commerce Secretary Gina Raimondo Suggests Trump Made Up ...","Aug 21, 2024 ... When asked during an ABC News interview whether the damaging jobs report could hurt Democrat presidential nominee Vice President Kamala Harris' campaign ..."
"https://www.dailywire.com/news/harris-picks-walz-for-vp-i-am-delighted-the-mask-is-off","Harris Picks Walz For VP. I Am Delighted — The Mask Is Off.","Aug 6, 2024 ... Kamala Harris's pick as her vice-presidential candidate is Minnesota Governor Tim Walz. I am delighted. There are many reasons I am pleased about this, ..."
"https://www.dailywire.com/news/the-party-that-hates-men-is-wondering-why-theyre-losing-male-voters","The Party That Hates Men Is Wondering Why They're Losing Male ...","Oct 14, 2024 ... the Kamala Harris campaign unveiled their ace-in-the-hole — their foolproof plan to win over male voters and dominate the upcoming presidential election ..."
"https://www.dailywire.com/news/60-minutes-finally-responds-to-scandal-over-deceptive-editing-of-kamala-interview","'60 Minutes' Finally Responds To Scandal Over Deceptive Editing Of ...","Oct 20, 2024 ... ... Kamala Harris. The show claimed without providing evidence that the allegation that it deceitfully edited its interview with Harris was “false.” “60 Minutes ..."
"https://www.dailywire.com/news/abc-debate-host-david-muirs-show-was-100-positive-for-harris-93-negative-for-trump-report","ABC Debate Host David Muir's Show Was 100% Positive For Harris ...","Sep 10, 2024 ... ... Kamala Harris since she entered the presidential race and a staggering 93% negative coverage to former President Donald Trump. Analysts looked at all of the ..."
"https://www.dailywire.com/news/america-is-always-disappointing-her-michelle-obama-trashed-for-racist-last-ditch-kamala-pitch","'America Is Always Disappointing Her': Michelle Obama Trashed For ...","Oct 27, 2024 ... Former First Lady Michelle Obama has hit the campaign trail for Vice President Kamala Harris — but critics are panning her 11th-hour sales pitch as “racist” and ..."
